  1   0.000000 10.29.96.106 -> 192.30.252.89 TCP 54 60803→443 [ACK] Seq=1 Ack=1 Win=4096 Len=0
  2   0.072567 192.30.252.89 -> 10.29.96.106 TCP 66 [TCP ACKed unseen segment] 443→60803 [ACK] Seq=1 Ack=2 Win=31 Len=0 TSval=652510231 TSecr=374780474
  3   0.240574 10.29.96.106 -> 216.58.193.78 TCP 78 61620→443 [SYN] Seq=0 Win=65535 Len=0 MSS=1460 WS=32 TSval=374826282 TSecr=0 SACK_PERM=1
  4   0.262271 216.58.193.78 -> 10.29.96.106 TCP 74 443→61620 [SYN, ACK] Seq=0 Ack=1 Win=42540 Len=0 MSS=1430 SACK_PERM=1 TSval=943636087 TSecr=374826282 WS=128
  5   0.262345 10.29.96.106 -> 216.58.193.78 TCP 66 61620→443 [ACK] Seq=1 Ack=1 Win=131872 Len=0 TSval=374826303 TSecr=943636087
  6   0.262525 10.29.96.106 -> 216.58.193.78 SSL 168 Client Hello
  7   0.284438 216.58.193.78 -> 10.29.96.106 TCP 66 443→61620 [ACK] Seq=1 Ack=103 Win=42624 Len=0 TSval=943636109 TSecr=374826303
  8   0.284629 216.58.193.78 -> 10.29.96.106 TLSv1 1484 Server Hello
  9   0.284655 216.58.193.78 -> 10.29.96.106 TCP 1484 [TCP segment of a reassembled PDU]
 10   0.284726 216.58.193.78 -> 10.29.96.106 TLSv1 1196 Certificate
 11   0.284741 10.29.96.106 -> 216.58.193.78 TCP 66 61620→443 [ACK] Seq=103 Ack=2837 Win=129024 Len=0 TSval=374826325 TSecr=943636109
 12   0.284771 10.29.96.106 -> 216.58.193.78 TCP 66 61620→443 [ACK] Seq=103 Ack=3967 Win=127904 Len=0 TSval=374826325 TSecr=943636110
 13   0.284810 10.29.96.106 -> 216.58.193.78 TCP 66 [TCP Window Update] 61620→443 [ACK] Seq=103 Ack=3967 Win=131040 Len=0 TSval=374826325 TSecr=943636110
 14   0.285549 10.29.96.106 -> 216.58.193.78 TLSv1 392 Client Key Exchange, Change Cipher Spec, Encrypted Handshake Message
 15   0.309002 216.58.193.78 -> 10.29.96.106 TLSv1 320 New Session Ticket, Change Cipher Spec, Encrypted Handshake Message
 16   0.309070 10.29.96.106 -> 216.58.193.78 TCP 66 61620→443 [ACK] Seq=429 Ack=4221 Win=130816 Len=0 TSval=374826349 TSecr=943636134
 17   0.309466 10.29.96.106 -> 216.58.193.78 TLSv1 492 Application Data, Application Data
 18   0.370395 216.58.193.78 -> 10.29.96.106 TCP 66 443→61620 [ACK] Seq=4221 Ack=855 Win=44800 Len=0 TSval=943636196 TSecr=374826349
 19   0.485875 216.58.193.78 -> 10.29.96.106 TLSv1 711 Application Data
 20   0.485973 216.58.193.78 -> 10.29.96.106 TLSv1 183 Application Data
 21   0.485990 10.29.96.106 -> 216.58.193.78 TCP 66 61620→443 [ACK] Seq=855 Ack=4866 Win=130400 Len=0 TSval=374826523 TSecr=943636310
 22   0.486029 10.29.96.106 -> 216.58.193.78 TCP 66 61620→443 [ACK] Seq=855 Ack=4983 Win=130304 Len=0 TSval=374826523 TSecr=943636310
 23   0.486645 216.58.193.78 -> 10.29.96.106 TLSv1 1479 Application Data
 24   0.486682 216.58.193.78 -> 10.29.96.106 TLSv1 199 Application Data
 25   0.486723 10.29.96.106 -> 216.58.193.78 TCP 66 61620→443 [ACK] Seq=855 Ack=6396 Win=129536 Len=0 TSval=374826523 TSecr=943636312
 26   0.486723 10.29.96.106 -> 216.58.193.78 TCP 66 61620→443 [ACK] Seq=855 Ack=6529 Win=129408 Len=0 TSval=374826523 TSecr=943636312
 27   0.490126 10.29.96.106 -> 216.58.193.78 TCP 66 61620→443 [FIN, ACK] Seq=855 Ack=6529 Win=131072 Len=0 TSval=374826527 TSecr=943636312
 28   0.495730 10.29.96.106 -> 216.58.192.47 TCP 78 61621→443 [SYN] Seq=0 Win=65535 Len=0 MSS=1460 WS=32 TSval=374826532 TSecr=0 SACK_PERM=1
 29   0.500852 216.58.192.47 -> 10.29.96.106 TCP 74 443→61621 [SYN, ACK] Seq=0 Ack=1 Win=42540 Len=0 MSS=1430 SACK_PERM=1 TSval=3722013842 TSecr=374826532 WS=128
 30   0.500941 10.29.96.106 -> 216.58.192.47 TCP 66 61621→443 [ACK] Seq=1 Ack=1 Win=131872 Len=0 TSval=374826537 TSecr=3722013842
 31   0.501218 10.29.96.106 -> 216.58.192.47 SSL 172 Client Hello
 32   0.506087 216.58.192.47 -> 10.29.96.106 TCP 66 443→61621 [ACK] Seq=1 Ack=107 Win=42624 Len=0 TSval=3722013848 TSecr=374826537
 33   0.506271 216.58.192.47 -> 10.29.96.106 TLSv1 1484 Server Hello
 34   0.506277 216.58.192.47 -> 10.29.96.106 TCP 1484 [TCP segment of a reassembled PDU]
 35   0.506303 216.58.192.47 -> 10.29.96.106 TLSv1 577 Certificate
 36   0.506360 10.29.96.106 -> 216.58.192.47 TCP 66 61621→443 [ACK] Seq=107 Ack=2837 Win=129024 Len=0 TSval=374826542 TSecr=3722013848
 37   0.506360 10.29.96.106 -> 216.58.192.47 TCP 66 61621→443 [ACK] Seq=107 Ack=3348 Win=128512 Len=0 TSval=374826542 TSecr=3722013848
 38   0.507091 10.29.96.106 -> 216.58.192.47 TLSv1 392 Client Key Exchange, Change Cipher Spec, Encrypted Handshake Message
 39   0.512666 216.58.193.78 -> 10.29.96.106 TCP 66 443→61620 [FIN, ACK] Seq=6529 Ack=856 Win=44800 Len=0 TSval=943636338 TSecr=374826527
 40   0.512752 10.29.96.106 -> 216.58.193.78 TCP 66 61620→443 [ACK] Seq=856 Ack=6530 Win=131072 Len=0 TSval=374826548 TSecr=943636338
 41   0.513941 216.58.192.47 -> 10.29.96.106 TLSv1 320 New Session Ticket, Change Cipher Spec, Encrypted Handshake Message
 42   0.514017 10.29.96.106 -> 216.58.192.47 TCP 66 61621→443 [ACK] Seq=433 Ack=3602 Win=130816 Len=0 TSval=374826549 TSecr=3722013855
 43   0.514364 10.29.96.106 -> 216.58.192.47 TLSv1 748 Application Data, Application Data
 44   0.514518 10.29.96.106 -> 216.58.192.47 TLSv1 1484 Application Data, Application Data, Application Data, Application Data, Application Data, Application Data, Application Data
 45   0.514518 10.29.96.106 -> 216.58.192.47 TCP 1484 [TCP segment of a reassembled PDU]
 46   0.519569 216.58.192.47 -> 10.29.96.106 TCP 66 443→61621 [ACK] Seq=3602 Ack=2533 Win=47872 Len=0 TSval=3722013861 TSecr=374826549
 47   0.519675 10.29.96.106 -> 216.58.192.47 TCP 1484 [TCP segment of a reassembled PDU]
 48   0.519676 10.29.96.106 -> 216.58.192.47 TLSv1 1156 Application Data
 49   0.524451 216.58.192.47 -> 10.29.96.106 TCP 66 443→61621 [ACK] Seq=3602 Ack=5369 Win=53504 Len=0 TSval=3722013866 TSecr=374826549
 50   0.565940 216.58.192.47 -> 10.29.96.106 TCP 66 443→61621 [ACK] Seq=3602 Ack=6459 Win=56320 Len=0 TSval=3722013907 TSecr=374826554
 51   1.078217   10.29.96.2 -> 224.0.0.18   VRRP 54 Announcement (v2)
 52   1.182444   10.29.96.2 -> 224.0.0.13   PIMv2 78 Hello
 53   1.182448   10.29.96.2 -> 224.0.0.13   PIMv2 78 Hello
 54   1.600417 10.29.112.254 -> 224.0.0.251  MDNS 139 Standard query response 0x0000  TXT, cache flush
 55   1.704792  10.29.112.2 -> 224.0.0.18   VRRP 54 Announcement (v2)
 56   2.021100 216.58.192.47 -> 10.29.96.106 TLSv1 1479 Application Data
 57   2.021173 216.58.192.47 -> 10.29.96.106 TLSv1 1479 Application Data
 58   2.021184 10.29.96.106 -> 216.58.192.47 TCP 66 61621→443 [ACK] Seq=6459 Ack=5015 Win=129632 Len=0 TSval=374828045 TSecr=3722015276
 59   2.021219 10.29.96.106 -> 216.58.192.47 TCP 66 61621→443 [ACK] Seq=6459 Ack=6428 Win=128224 Len=0 TSval=374828045 TSecr=3722015276
 60   2.021396 216.58.192.47 -> 10.29.96.106 TLSv1 1479 Application Data
 61   2.021399 216.58.192.47 -> 10.29.96.106 TLSv1 471 Application Data
 62   2.021400 216.58.192.47 -> 10.29.96.106 TLSv1 471 [TCP Retransmission] Application Data
 63   2.021425 10.29.96.106 -> 216.58.192.47 TCP 66 61621→443 [ACK] Seq=6459 Ack=7841 Win=128224 Len=0 TSval=374828045 TSecr=3722015276
 64   2.021436 10.29.96.106 -> 216.58.192.47 TCP 66 61621→443 [ACK] Seq=6459 Ack=8246 Win=127840 Len=0 TSval=374828045 TSecr=3722015276
 65   2.021447 10.29.96.106 -> 216.58.192.47 TCP 66 [TCP Dup ACK 64#1] 61621→443 [ACK] Seq=6459 Ack=8246 Win=127840 Len=0 TSval=374828045 TSecr=3722015288
 66   2.023037 10.29.96.106 -> 216.58.192.47 TCP 66 [TCP Window Update] 61621→443 [ACK] Seq=6459 Ack=8246 Win=131072 Len=0 TSval=374828046 TSecr=3722015288
 67   2.023237 10.29.96.106 -> 216.58.192.47 TCP 66 61621→443 [FIN, ACK] Seq=6459 Ack=8246 Win=131072 Len=0 TSval=374828046 TSecr=3722015288
 68   2.026322 173.194.203.125 -> 10.29.96.106 TCP 551 [TCP segment of a reassembled PDU]
 69   2.026396 10.29.96.106 -> 173.194.203.125 TCP 66 60139→5222 [ACK] Seq=1 Ack=486 Win=4080 Len=0 TSval=374828049 TSecr=2593614527
 70   2.028158 216.58.192.47 -> 10.29.96.106 TCP 66 443→61621 [FIN, ACK] Seq=8246 Ack=6460 Win=56320 Len=0 TSval=3722015370 TSecr=374828046
 71   2.028190 10.29.96.106 -> 216.58.192.47 TCP 66 61621→443 [ACK] Seq=6460 Ack=8247 Win=131072 Len=0 TSval=374828050 TSecr=3722015370
 72   2.033457 173.194.203.125 -> 10.29.96.106 TCP 551 [TCP segment of a reassembled PDU]
 73   2.033530 10.29.96.106 -> 173.194.203.125 TCP 66 60139→5222 [ACK] Seq=1 Ack=971 Win=4080 Len=0 TSval=374828055 TSecr=2593614534
 74   2.171797  10.29.96.48 -> 224.0.0.251  MDNS 194 Standard query response 0x0000  PTR 4c:7c:5f:9f:54:e8@fe80::4e7c:5fff:fe9f:54e8._apple-mobdev2._tcp.local PTR 4c:7c:5f:9f:54:e8@fe80::4e7c:5fff:fe9f:54e8._apple-mobdev2._tcp.local
 75   2.264504 10.29.96.106 -> 216.58.193.78 TCP 78 61622→443 [SYN] Seq=0 Win=65535 Len=0 MSS=1460 WS=32 TSval=374828284 TSecr=0 SACK_PERM=1
 76   2.288987 216.58.193.78 -> 10.29.96.106 TCP 74 443→61622 [SYN, ACK] Seq=0 Ack=1 Win=42540 Len=0 MSS=1430 SACK_PERM=1 TSval=900440348 TSecr=374828284 WS=128
 77   2.289069 10.29.96.106 -> 216.58.193.78 TCP 66 61622→443 [ACK] Seq=1 Ack=1 Win=131872 Len=0 TSval=374828308 TSecr=900440348
 78   2.289251 10.29.96.106 -> 216.58.193.78 SSL 168 Client Hello
 79   2.311311 216.58.193.78 -> 10.29.96.106 TCP 66 443→61622 [ACK] Seq=1 Ack=103 Win=42624 Len=0 TSval=900440371 TSecr=374828308
 80   2.311882 216.58.193.78 -> 10.29.96.106 TLSv1 1484 Server Hello
 81   2.311886 216.58.193.78 -> 10.29.96.106 TCP 1484 [TCP segment of a reassembled PDU]
 82   2.311965 10.29.96.106 -> 216.58.193.78 TCP 66 61622→443 [ACK] Seq=103 Ack=2837 Win=129024 Len=0 TSval=374828330 TSecr=900440371
 83   2.312071 216.58.193.78 -> 10.29.96.106 TLSv1 1196 Certificate
 84   2.312124 10.29.96.106 -> 216.58.193.78 TCP 66 61622→443 [ACK] Seq=103 Ack=3967 Win=129920 Len=0 TSval=374828330 TSecr=900440371
 85   2.312846 10.29.96.106 -> 216.58.193.78 TLSv1 392 Client Key Exchange, Change Cipher Spec, Encrypted Handshake Message
 86   2.336468 216.58.193.78 -> 10.29.96.106 TLSv1 320 New Session Ticket, Change Cipher Spec, Encrypted Handshake Message
 87   2.336586 10.29.96.106 -> 216.58.193.78 TCP 66 61622→443 [ACK] Seq=429 Ack=4221 Win=130816 Len=0 TSval=374828354 TSecr=900440396
 88   2.337043 10.29.96.106 -> 216.58.193.78 TLSv1 540 Application Data, Application Data
 89   2.398482 216.58.193.78 -> 10.29.96.106 TCP 66 443→61622 [ACK] Seq=4221 Ack=903 Win=44800 Len=0 TSval=900440458 TSecr=374828354
 90   2.509932 216.58.193.78 -> 10.29.96.106 TLSv1 711 Application Data
 91   2.510015 216.58.193.78 -> 10.29.96.106 TLSv1 199 Application Data
 92   2.510036 10.29.96.106 -> 216.58.193.78 TCP 66 61622→443 [ACK] Seq=903 Ack=4866 Win=130400 Len=0 TSval=374828526 TSecr=900440569
 93   2.510094 10.29.96.106 -> 216.58.193.78 TCP 66 61622→443 [ACK] Seq=903 Ack=4999 Win=130272 Len=0 TSval=374828526 TSecr=900440569
 94   2.510650 216.58.193.78 -> 10.29.96.106 TLSv1 1479 Application Data
 95   2.510675 216.58.193.78 -> 10.29.96.106 TLSv1 583 Application Data
 96   2.510703 10.29.96.106 -> 216.58.193.78 TCP 66 61622→443 [ACK] Seq=903 Ack=6412 Win=129504 Len=0 TSval=374828526 TSecr=900440570
 97   2.510710 10.29.96.106 -> 216.58.193.78 TCP 66 61622→443 [ACK] Seq=903 Ack=6929 Win=128992 Len=0 TSval=374828526 TSecr=900440570
 98   2.514166 10.29.96.106 -> 216.58.193.78 TCP 66 61622→443 [FIN, ACK] Seq=903 Ack=6929 Win=131072 Len=0 TSval=374828529 TSecr=900440570
 99   2.536261 216.58.193.78 -> 10.29.96.106 TCP 66 443→61622 [FIN, ACK] Seq=6929 Ack=904 Win=44800 Len=0 TSval=900440595 TSecr=374828529
100   2.536341 10.29.96.106 -> 216.58.193.78 TCP 66 61622→443 [ACK] Seq=904 Ack=6930 Win=131072 Len=0 TSval=374828550 TSecr=900440595
101   2.602049 10.29.96.106 -> 173.194.203.125 TCP 588 [TCP segment of a reassembled PDU]
102   2.626641 10.29.112.254 -> 224.0.0.251  MDNS 91 Standard query 0x0000  PTR _raop._tcp.local, "QU" question PTR _airplay._tcp.local, "QU" question
103   2.626696 173.194.203.125 -> 10.29.96.106 TCP 66 5222→60139 [ACK] Seq=971 Ack=523 Win=1558 Len=0 TSval=2593615128 TSecr=374828615
104   2.635670 173.194.203.125 -> 10.29.96.106 TCP 551 [TCP segment of a reassembled PDU]
105   2.635752 10.29.96.106 -> 173.194.203.125 TCP 66 60139→5222 [ACK] Seq=523 Ack=1456 Win=4080 Len=0 TSval=374828646 TSecr=2593615136
106   2.749378   10.29.96.2 -> 224.0.0.18   VRRP 54 Announcement (v2)
107   3.126751 10.29.96.106 -> 173.194.203.125 TCP 556 [TCP segment of a reassembled PDU]
108   3.197187 173.194.203.125 -> 10.29.96.106 TCP 66 5222→60139 [ACK] Seq=1456 Ack=1013 Win=1567 Len=0 TSval=2593615698 TSecr=374829134
109   3.381792  10.29.112.2 -> 224.0.0.18   VRRP 54 Announcement (v2)
110   3.389117 10.29.96.188 -> 224.0.0.251  MDNS 246 Standard query 0x0000  PTR _airport._tcp.local, "QU" question PTR _ipp._tcp.local, "QU" question PTR _scanner._tcp.local, "QU" question PTR _printer._tcp.local, "QU" question PTR _uscan._tcp.local, "QU" question PTR _uscans._tcp.local, "QU" question PTR _ptp._tcp.local, "QU" question PTR _raop._tcp.local, "QU" question PTR _airplay._tcp.local, "QU" question PTR _privet._tcp.local, "QU" question PTR _sleep-proxy._udp.local, "QU" question
111   3.480532 10.29.96.188 -> 255.255.255.255 DB-LSP-DISC 196 Dropbox LAN sync Discovery Protocol
112   3.480616 10.29.96.188 -> 10.29.111.255 DB-LSP-DISC 196 Dropbox LAN sync Discovery Protocol
113   3.585018 10.29.96.188 -> 224.0.0.251  MDNS 246 Standard query 0x0000  PTR _airport._tcp.local, "QU" question PTR _ipp._tcp.local, "QU" question PTR _scanner._tcp.local, "QU" question PTR _printer._tcp.local, "QU" question PTR _uscan._tcp.local, "QU" question PTR _uscans._tcp.local, "QU" question PTR _ptp._tcp.local, "QU" question PTR _raop._tcp.local, "QU" question PTR _airplay._tcp.local, "QU" question PTR _privet._tcp.local, "QU" question PTR _sleep-proxy._udp.local, "QU" question
114   3.793900 10.29.112.254 -> 224.0.0.251  MDNS 91 Standard query 0x0000  PTR _raop._tcp.local, "QM" question PTR _airplay._tcp.local, "QM" question
115   4.211593 10.29.96.188 -> 224.0.0.251  MDNS 161 Standard query 0x0000  ANY Quintons-MacBook-Pro-2.local, "QU" question ANY Quintons-MacBook-Pro-2.local, "QU" question
116   4.420573 10.29.96.188 -> 224.0.0.251  MDNS 161 Standard query 0x0000  ANY Quintons-MacBook-Pro-2.local, "QM" question ANY Quintons-MacBook-Pro-2.local, "QM" question
117   4.629648   10.29.96.2 -> 224.0.0.18   VRRP 54 Announcement (v2)
118   4.629652 10.29.96.188 -> 224.0.0.251  MDNS 246 Standard query 0x0000  PTR _airport._tcp.local, "QU" question PTR _ipp._tcp.local, "QU" question PTR _scanner._tcp.local, "QU" question PTR _printer._tcp.local, "QU" question PTR _uscan._tcp.local, "QU" question PTR _uscans._tcp.local, "QU" question PTR _ptp._tcp.local, "QU" question PTR _raop._tcp.local, "QU" question PTR _airplay._tcp.local, "QU" question PTR _privet._tcp.local, "QU" question PTR _sleep-proxy._udp.local, "QM" question
119   4.942854 10.29.113.53 -> 10.29.127.255 UDP 86 Source port: 57621  Destination port: 57621
120   4.942907 10.29.96.188 -> 224.0.0.251  MDNS 161 Standard query 0x0000  ANY Quintons-MacBook-Pro-2.local, "QM" question ANY Quintons-MacBook-Pro-2.local, "QM" question
121   5.151766  10.29.112.2 -> 224.0.0.18   VRRP 54 Announcement (v2)
122   5.256208 10.29.96.188 -> 224.0.0.251  MDNS 326 Standard query response 0x0000  PTR, cache flush Quintons-MacBook-Pro-2.local PTR, cache flush Quintons-MacBook-Pro-2.local AAAA, cache flush fe80::a65e:60ff:fee7:f941 A, cache flush 10.29.96.188
123   5.882940 10.29.96.188 -> 224.0.0.251  MDNS 222 Standard query 0x0000  PTR _airport._tcp.local, "QM" question PTR _ipp._tcp.local, "QM" question PTR _scanner._tcp.local, "QM" question PTR _printer._tcp.local, "QM" question PTR _uscan._tcp.local, "QM" question PTR _uscans._tcp.local, "QM" question PTR _ptp._tcp.local, "QM" question PTR _raop._tcp.local, "QM" question PTR _airplay._tcp.local, "QM" question PTR _privet._tcp.local, "QM" question
124   6.091790   10.29.96.2 -> 224.0.0.18   VRRP 54 Announcement (v2)
125   6.091817 10.29.113.88 -> 224.0.0.251  MDNS 87 Standard query 0x0000  PTR _spotify-connect._tcp.local, "QU" question
126   6.091910 10.29.113.88 -> 239.255.255.250 SSDP 169 M-SEARCH * HTTP/1.1 
127   6.196212 10.29.96.188 -> 224.0.0.251  MDNS 326 Standard query response 0x0000  PTR, cache flush Quintons-MacBook-Pro-2.local PTR, cache flush Quintons-MacBook-Pro-2.local AAAA, cache flush fe80::a65e:60ff:fee7:f941 A, cache flush 10.29.96.188
128   6.718466  10.29.112.2 -> 224.0.0.18   VRRP 54 Announcement (v2)
129   6.927359 10.29.112.254 -> 224.0.0.251  MDNS 91 Standard query 0x0000  PTR _raop._tcp.local, "QM" question PTR _airplay._tcp.local, "QM" question
130   6.927441 10.29.96.188 -> 224.0.0.251  MDNS 326 Standard query response 0x0000  PTR, cache flush Quintons-MacBook-Pro-2.local PTR, cache flush Quintons-MacBook-Pro-2.local AAAA, cache flush fe80::a65e:60ff:fee7:f941 A, cache flush 10.29.96.188
131   7.965397 10.29.96.106 -> 173.194.203.125 TCP 67 [TCP segment of a reassembled PDU]
132   7.971861   10.29.96.2 -> 224.0.0.18   VRRP 54 Announcement (v2)
133   8.076076 10.29.96.216 -> 224.0.0.251  MDNS 87 Standard query 0x0000  PTR _spotify-connect._tcp.local, "QU" question
134   8.076123 10.29.96.216 -> 239.255.255.250 SSDP 169 M-SEARCH * HTTP/1.1 
135   8.184067 173.194.203.125 -> 10.29.96.106 TCP 66 5222→60139 [ACK] Seq=1456 Ack=1014 Win=1567 Len=0 TSval=2593620493 TSecr=374833963
136   8.184245 10.29.96.106 -> 173.194.203.125 TCP 67 [TCP segment of a reassembled PDU]
137   8.208817 173.194.203.125 -> 10.29.96.106 TCP 66 5222→60139 [ACK] Seq=1456 Ack=1015 Win=1567 Len=0 TSval=2593620710 TSecr=374834180
138   8.209016 10.29.96.106 -> 173.194.203.125 TCP 67 [TCP segment of a reassembled PDU]
139   8.234450 173.194.203.125 -> 10.29.96.106 TCP 66 5222→60139 [ACK] Seq=1456 Ack=1016 Win=1567 Len=0 TSval=2593620735 TSecr=374834204
140   8.234599 10.29.96.106 -> 173.194.203.125 TCP 67 [TCP segment of a reassembled PDU]
141   8.259148 173.194.203.125 -> 10.29.96.106 TCP 66 5222→60139 [ACK] Seq=1456 Ack=1017 Win=1567 Len=0 TSval=2593620760 TSecr=374834229
142   8.259325 10.29.96.106 -> 173.194.203.125 TCP 67 [TCP segment of a reassembled PDU]
143   8.284044 173.194.203.125 -> 10.29.96.106 TCP 66 5222→60139 [ACK] Seq=1456 Ack=1018 Win=1567 Len=0 TSval=2593620785 TSecr=374834253
144   8.284211 10.29.96.106 -> 173.194.203.125 TCP 67 [TCP segment of a reassembled PDU]
145   8.308953 173.194.203.125 -> 10.29.96.106 TCP 66 5222→60139 [ACK] Seq=1456 Ack=1019 Win=1567 Len=0 TSval=2593620810 TSecr=374834277
146   8.309123 10.29.96.106 -> 173.194.203.125 TCP 67 [TCP segment of a reassembled PDU]
147   8.333675 173.194.203.125 -> 10.29.96.106 TCP 66 5222→60139 [ACK] Seq=1456 Ack=1020 Win=1567 Len=0 TSval=2593620835 TSecr=374834301
148   8.333832 10.29.96.106 -> 173.194.203.125 TCP 67 [TCP segment of a reassembled PDU]
149   8.358535 173.194.203.125 -> 10.29.96.106 TCP 66 5222→60139 [ACK] Seq=1456 Ack=1021 Win=1567 Len=0 TSval=2593620859 TSecr=374834325
150   8.358692 10.29.96.106 -> 173.194.203.125 TCP 67 [TCP segment of a reassembled PDU]
151   8.383572 173.194.203.125 -> 10.29.96.106 TCP 66 5222→60139 [ACK] Seq=1456 Ack=1022 Win=1567 Len=0 TSval=2593620884 TSecr=374834349
152   8.383688 10.29.96.106 -> 173.194.203.125 TCP 67 [TCP segment of a reassembled PDU]
153   8.408438 173.194.203.125 -> 10.29.96.106 TCP 66 5222→60139 [ACK] Seq=1456 Ack=1023 Win=1567 Len=0 TSval=2593620909 TSecr=374834374
154   8.408583 10.29.96.106 -> 173.194.203.125 TCP 67 [TCP segment of a reassembled PDU]
155   8.415462 10.29.113.88 -> 10.29.127.255 UDP 86 Source port: 57621  Destination port: 57621
156   8.433251 173.194.203.125 -> 10.29.96.106 TCP 66 5222→60139 [ACK] Seq=1456 Ack=1024 Win=1567 Len=0 TSval=2593620934 TSecr=374834398
157   8.433422 10.29.96.106 -> 173.194.203.125 TCP 67 [TCP segment of a reassembled PDU]
158   8.458139 173.194.203.125 -> 10.29.96.106 TCP 66 5222→60139 [ACK] Seq=1456 Ack=1025 Win=1567 Len=0 TSval=2593620959 TSecr=374834422
159   8.458256 10.29.96.106 -> 173.194.203.125 TCP 67 [TCP segment of a reassembled PDU]
160   8.483044 173.194.203.125 -> 10.29.96.106 TCP 66 5222→60139 [ACK] Seq=1456 Ack=1026 Win=1567 Len=0 TSval=2593620984 TSecr=374834446
161   8.483212 10.29.96.106 -> 173.194.203.125 TCP 67 [TCP segment of a reassembled PDU]
162   8.507808 173.194.203.125 -> 10.29.96.106 TCP 66 5222→60139 [ACK] Seq=1456 Ack=1027 Win=1567 Len=0 TSval=2593621009 TSecr=374834470
163   8.507928 10.29.96.106 -> 173.194.203.125 TCP 67 [TCP segment of a reassembled PDU]
164   8.532605 173.194.203.125 -> 10.29.96.106 TCP 66 5222→60139 [ACK] Seq=1456 Ack=1028 Win=1567 Len=0 TSval=2593621033 TSecr=374834494
165   8.532724 10.29.96.106 -> 173.194.203.125 TCP 67 [TCP segment of a reassembled PDU]
166   8.557270 173.194.203.125 -> 10.29.96.106 TCP 66 5222→60139 [ACK] Seq=1456 Ack=1029 Win=1567 Len=0 TSval=2593621058 TSecr=374834518
167   8.557399 10.29.96.106 -> 173.194.203.125 TCP 67 [TCP segment of a reassembled PDU]
168   8.582220 173.194.203.125 -> 10.29.96.106 TCP 66 5222→60139 [ACK] Seq=1456 Ack=1030 Win=1567 Len=0 TSval=2593621083 TSecr=374834542
169   8.582345 10.29.96.106 -> 173.194.203.125 TCP 67 [TCP segment of a reassembled PDU]
170   8.607517 173.194.203.125 -> 10.29.96.106 TCP 66 5222→60139 [ACK] Seq=1456 Ack=1031 Win=1567 Len=0 TSval=2593621108 TSecr=374834566
171   8.607663 10.29.96.106 -> 173.194.203.125 TCP 67 [TCP segment of a reassembled PDU]
172   8.630986  10.29.96.64 -> 239.255.255.250 SSDP 169 M-SEARCH * HTTP/1.1 
173   8.632295 173.194.203.125 -> 10.29.96.106 TCP 66 5222→60139 [ACK] Seq=1456 Ack=1032 Win=1567 Len=0 TSval=2593621133 TSecr=374834591
174   8.632470 10.29.96.106 -> 173.194.203.125 TCP 67 [TCP segment of a reassembled PDU]
175   8.640779  10.29.112.2 -> 224.0.0.18   VRRP 54 Announcement (v2)
176   8.657104 173.194.203.125 -> 10.29.96.106 TCP 66 5222→60139 [ACK] Seq=1456 Ack=1033 Win=1567 Len=0 TSval=2593621158 TSecr=374834615
177   8.657242 10.29.96.106 -> 173.194.203.125 TCP 67 [TCP segment of a reassembled PDU]
178   8.681983 173.194.203.125 -> 10.29.96.106 TCP 66 5222→60139 [ACK] Seq=1456 Ack=1034 Win=1567 Len=0 TSval=2593621183 TSecr=374834639
179   8.682154 10.29.96.106 -> 173.194.203.125 TCP 67 [TCP segment of a reassembled PDU]
180   8.707341 173.194.203.125 -> 10.29.96.106 TCP 66 5222→60139 [ACK] Seq=1456 Ack=1035 Win=1567 Len=0 TSval=2593621208 TSecr=374834663
181   8.707495 10.29.96.106 -> 173.194.203.125 TCP 67 [TCP segment of a reassembled PDU]
182   8.732105 173.194.203.125 -> 10.29.96.106 TCP 66 5222→60139 [ACK] Seq=1456 Ack=1036 Win=1567 Len=0 TSval=2593621233 TSecr=374834688
183   8.732211 10.29.96.106 -> 173.194.203.125 TCP 67 [TCP segment of a reassembled PDU]
184   8.756716 173.194.203.125 -> 10.29.96.106 TCP 66 5222→60139 [ACK] Seq=1456 Ack=1037 Win=1567 Len=0 TSval=2593621258 TSecr=374834711
185   8.756863 10.29.96.106 -> 173.194.203.125 TCP 67 [TCP segment of a reassembled PDU]
186   8.781970 173.194.203.125 -> 10.29.96.106 TCP 66 5222→60139 [ACK] Seq=1456 Ack=1038 Win=1567 Len=0 TSval=2593621283 TSecr=374834735
187   8.782085 10.29.96.106 -> 173.194.203.125 TCP 67 [TCP segment of a reassembled PDU]
188   8.806570 173.194.203.125 -> 10.29.96.106 TCP 66 5222→60139 [ACK] Seq=1456 Ack=1039 Win=1567 Len=0 TSval=2593621308 TSecr=374834760
189   8.806691 10.29.96.106 -> 173.194.203.125 TCP 67 [TCP segment of a reassembled PDU]
190   8.831789 173.194.203.125 -> 10.29.96.106 TCP 66 5222→60139 [ACK] Seq=1456 Ack=1040 Win=1567 Len=0 TSval=2593621333 TSecr=374834784
191   8.831908 10.29.96.106 -> 173.194.203.125 TCP 67 [TCP segment of a reassembled PDU]
192   8.857493 173.194.203.125 -> 10.29.96.106 TCP 66 5222→60139 [ACK] Seq=1456 Ack=1041 Win=1567 Len=0 TSval=2593621358 TSecr=374834809
193   8.857648 10.29.96.106 -> 173.194.203.125 TCP 67 [TCP segment of a reassembled PDU]
194   8.882698 173.194.203.125 -> 10.29.96.106 TCP 66 5222→60139 [ACK] Seq=1456 Ack=1042 Win=1567 Len=0 TSval=2593621384 TSecr=374834834
195   8.882797 10.29.96.106 -> 173.194.203.125 TCP 67 [TCP segment of a reassembled PDU]
196   8.907895 173.194.203.125 -> 10.29.96.106 TCP 66 5222→60139 [ACK] Seq=1456 Ack=1043 Win=1567 Len=0 TSval=2593621409 TSecr=374834858
197   8.907992 10.29.96.106 -> 173.194.203.125 TCP 67 [TCP segment of a reassembled PDU]
198   8.933440 173.194.203.125 -> 10.29.96.106 TCP 66 5222→60139 [ACK] Seq=1456 Ack=1044 Win=1567 Len=0 TSval=2593621434 TSecr=374834883
199   8.933546 10.29.96.106 -> 173.194.203.125 TCP 67 [TCP segment of a reassembled PDU]
200   8.958225 173.194.203.125 -> 10.29.96.106 TCP 66 5222→60139 [ACK] Seq=1456 Ack=1045 Win=1567 Len=0 TSval=2593621459 TSecr=374834908
201   8.958323 10.29.96.106 -> 173.194.203.125 TCP 67 [TCP segment of a reassembled PDU]
202   8.983108 173.194.203.125 -> 10.29.96.106 TCP 66 5222→60139 [ACK] Seq=1456 Ack=1046 Win=1567 Len=0 TSval=2593621484 TSecr=374834932
203   8.983269 10.29.96.106 -> 173.194.203.125 TCP 67 [TCP segment of a reassembled PDU]
204   9.008038 173.194.203.125 -> 10.29.96.106 TCP 66 5222→60139 [ACK] Seq=1456 Ack=1047 Win=1567 Len=0 TSval=2593621509 TSecr=374834956
205   9.008190 10.29.96.106 -> 173.194.203.125 TCP 67 [TCP segment of a reassembled PDU]
206   9.032914 173.194.203.125 -> 10.29.96.106 TCP 66 5222→60139 [ACK] Seq=1456 Ack=1048 Win=1567 Len=0 TSval=2593621534 TSecr=374834980
207   9.033028 10.29.96.106 -> 173.194.203.125 TCP 67 [TCP segment of a reassembled PDU]
208   9.058144 173.194.203.125 -> 10.29.96.106 TCP 66 5222→60139 [ACK] Seq=1456 Ack=1049 Win=1567 Len=0 TSval=2593621559 TSecr=374835004
209   9.058303 10.29.96.106 -> 173.194.203.125 TCP 67 [TCP segment of a reassembled PDU]
210   9.083670 173.194.203.125 -> 10.29.96.106 TCP 66 5222→60139 [ACK] Seq=1456 Ack=1050 Win=1567 Len=0 TSval=2593621584 TSecr=374835028
211   9.083841 10.29.96.106 -> 173.194.203.125 TCP 67 [TCP segment of a reassembled PDU]
212   9.108650 173.194.203.125 -> 10.29.96.106 TCP 66 5222→60139 [ACK] Seq=1456 Ack=1051 Win=1567 Len=0 TSval=2593621609 TSecr=374835052
213   9.108755 10.29.96.106 -> 173.194.203.125 TCP 67 [TCP segment of a reassembled PDU]
214   9.133374 173.194.203.125 -> 10.29.96.106 TCP 66 5222→60139 [ACK] Seq=1456 Ack=1052 Win=1567 Len=0 TSval=2593621634 TSecr=374835076
215   9.133469 10.29.96.106 -> 173.194.203.125 TCP 67 [TCP segment of a reassembled PDU]
216   9.158093 173.194.203.125 -> 10.29.96.106 TCP 66 5222→60139 [ACK] Seq=1456 Ack=1053 Win=1567 Len=0 TSval=2593621659 TSecr=374835100
217   9.158210 10.29.96.106 -> 173.194.203.125 TCP 67 [TCP segment of a reassembled PDU]
218   9.182824 173.194.203.125 -> 10.29.96.106 TCP 66 5222→60139 [ACK] Seq=1456 Ack=1054 Win=1567 Len=0 TSval=2593621684 TSecr=374835124
219   9.182962 10.29.96.106 -> 173.194.203.125 TCP 67 [TCP segment of a reassembled PDU]
220   9.207569 173.194.203.125 -> 10.29.96.106 TCP 66 5222→60139 [ACK] Seq=1456 Ack=1055 Win=1567 Len=0 TSval=2593621708 TSecr=374835149
221   9.207708 10.29.96.106 -> 173.194.203.125 TCP 67 [TCP segment of a reassembled PDU]
222   9.232380 173.194.203.125 -> 10.29.96.106 TCP 66 5222→60139 [ACK] Seq=1456 Ack=1056 Win=1567 Len=0 TSval=2593621733 TSecr=374835172
223   9.232499 10.29.96.106 -> 173.194.203.125 TCP 67 [TCP segment of a reassembled PDU]
224   9.257845 173.194.203.125 -> 10.29.96.106 TCP 66 5222→60139 [ACK] Seq=1456 Ack=1057 Win=1567 Len=0 TSval=2593621758 TSecr=374835197
225   9.258000 10.29.96.106 -> 173.194.203.125 TCP 67 [TCP segment of a reassembled PDU]
226   9.282617 173.194.203.125 -> 10.29.96.106 TCP 66 5222→60139 [ACK] Seq=1456 Ack=1058 Win=1567 Len=0 TSval=2593621783 TSecr=374835222
227   9.282717 10.29.96.106 -> 173.194.203.125 TCP 67 [TCP segment of a reassembled PDU]
228   9.307523 173.194.203.125 -> 10.29.96.106 TCP 66 5222→60139 [ACK] Seq=1456 Ack=1059 Win=1567 Len=0 TSval=2593621808 TSecr=374835246
229   9.307702 10.29.96.106 -> 173.194.203.125 TCP 67 [TCP segment of a reassembled PDU]
230   9.332391 173.194.203.125 -> 10.29.96.106 TCP 66 5222→60139 [ACK] Seq=1456 Ack=1060 Win=1567 Len=0 TSval=2593621833 TSecr=374835270
231   9.332534 10.29.96.106 -> 173.194.203.125 TCP 67 [TCP segment of a reassembled PDU]
232   9.357206 173.194.203.125 -> 10.29.96.106 TCP 66 5222→60139 [ACK] Seq=1456 Ack=1061 Win=1567 Len=0 TSval=2593621858 TSecr=374835295
233   9.357294 10.29.96.106 -> 173.194.203.125 TCP 67 [TCP segment of a reassembled PDU]
234   9.381861 173.194.203.125 -> 10.29.96.106 TCP 66 5222→60139 [ACK] Seq=1456 Ack=1062 Win=1567 Len=0 TSval=2593621883 TSecr=374835318
235   9.381980 10.29.96.106 -> 173.194.203.125 TCP 67 [TCP segment of a reassembled PDU]
236   9.406592 173.194.203.125 -> 10.29.96.106 TCP 66 5222→60139 [ACK] Seq=1456 Ack=1063 Win=1567 Len=0 TSval=2593621907 TSecr=374835343
237   9.406721 10.29.96.106 -> 173.194.203.125 TCP 67 [TCP segment of a reassembled PDU]
238   9.431578 173.194.203.125 -> 10.29.96.106 TCP 66 5222→60139 [ACK] Seq=1456 Ack=1064 Win=1567 Len=0 TSval=2593621932 TSecr=374835367
239   9.431709 10.29.96.106 -> 173.194.203.125 TCP 67 [TCP segment of a reassembled PDU]
240   9.456753 173.194.203.125 -> 10.29.96.106 TCP 66 5222→60139 [ACK] Seq=1456 Ack=1065 Win=1567 Len=0 TSval=2593621958 TSecr=374835391
241   9.456871 10.29.96.106 -> 173.194.203.125 TCP 67 [TCP segment of a reassembled PDU]
242   9.481460 173.194.203.125 -> 10.29.96.106 TCP 66 5222→60139 [ACK] Seq=1456 Ack=1066 Win=1567 Len=0 TSval=2593621982 TSecr=374835416
243   9.481575 10.29.96.106 -> 173.194.203.125 TCP 67 [TCP segment of a reassembled PDU]
244   9.488244 10.29.96.216 -> 239.255.255.250 SSDP 217 M-SEARCH * HTTP/1.1 
245   9.506234 173.194.203.125 -> 10.29.96.106 TCP 66 5222→60139 [ACK] Seq=1456 Ack=1067 Win=1567 Len=0 TSval=2593622007 TSecr=374835440
246   9.506355 10.29.96.106 -> 173.194.203.125 TCP 67 [TCP segment of a reassembled PDU]
247   9.531074 173.194.203.125 -> 10.29.96.106 TCP 66 5222→60139 [ACK] Seq=1456 Ack=1068 Win=1567 Len=0 TSval=2593622032 TSecr=374835464
248   9.531187 10.29.96.106 -> 173.194.203.125 TCP 67 [TCP segment of a reassembled PDU]
249   9.555757 173.194.203.125 -> 10.29.96.106 TCP 66 5222→60139 [ACK] Seq=1456 Ack=1069 Win=1567 Len=0 TSval=2593622057 TSecr=374835488
250   9.555879 10.29.96.106 -> 173.194.203.125 TCP 67 [TCP segment of a reassembled PDU]
251   9.580573 173.194.203.125 -> 10.29.96.106 TCP 66 5222→60139 [ACK] Seq=1456 Ack=1070 Win=1567 Len=0 TSval=2593622081 TSecr=374835512
252   9.580739 10.29.96.106 -> 173.194.203.125 TCP 67 [TCP segment of a reassembled PDU]
253   9.605399 173.194.203.125 -> 10.29.96.106 TCP 66 5222→60139 [ACK] Seq=1456 Ack=1071 Win=1567 Len=0 TSval=2593622106 TSecr=374835536
254   9.605520 10.29.96.106 -> 173.194.203.125 TCP 67 [TCP segment of a reassembled PDU]
255   9.630279 173.194.203.125 -> 10.29.96.106 TCP 66 5222→60139 [ACK] Seq=1456 Ack=1072 Win=1567 Len=0 TSval=2593622131 TSecr=374835561
256   9.630414 10.29.96.106 -> 173.194.203.125 TCP 67 [TCP segment of a reassembled PDU]
257   9.655115 173.194.203.125 -> 10.29.96.106 TCP 66 5222→60139 [ACK] Seq=1456 Ack=1073 Win=1567 Len=0 TSval=2593622156 TSecr=374835585
258   9.655303 10.29.96.106 -> 173.194.203.125 TCP 67 [TCP segment of a reassembled PDU]
259   9.679954 173.194.203.125 -> 10.29.96.106 TCP 66 5222→60139 [ACK] Seq=1456 Ack=1074 Win=1567 Len=0 TSval=2593622181 TSecr=374835609
260   9.680053 10.29.96.106 -> 173.194.203.125 TCP 67 [TCP segment of a reassembled PDU]
261   9.737711 173.194.203.125 -> 10.29.96.106 TCP 66 5222→60139 [ACK] Seq=1456 Ack=1075 Win=1567 Len=0 TSval=2593622206 TSecr=374835634
262   9.737793   10.29.96.2 -> 224.0.0.18   VRRP 54 Announcement (v2)
263   9.738054 10.29.96.106 -> 173.194.203.125 TCP 67 [TCP segment of a reassembled PDU]
264   9.763648 173.194.203.125 -> 10.29.96.106 TCP 66 5222→60139 [ACK] Seq=1456 Ack=1076 Win=1567 Len=0 TSval=2593622264 TSecr=374835689
265   9.763825 10.29.96.106 -> 173.194.203.125 TCP 67 [TCP segment of a reassembled PDU]
266   9.788439 173.194.203.125 -> 10.29.96.106 TCP 66 5222→60139 [ACK] Seq=1456 Ack=1077 Win=1567 Len=0 TSval=2593622289 TSecr=374835714
267   9.788545 10.29.96.106 -> 173.194.203.125 TCP 67 [TCP segment of a reassembled PDU]
268   9.813220 173.194.203.125 -> 10.29.96.106 TCP 66 5222→60139 [ACK] Seq=1456 Ack=1078 Win=1567 Len=0 TSval=2593622314 TSecr=374835738
269   9.813366 10.29.96.106 -> 173.194.203.125 TCP 67 [TCP segment of a reassembled PDU]
270   9.838171 173.194.203.125 -> 10.29.96.106 TCP 66 5222→60139 [ACK] Seq=1456 Ack=1079 Win=1567 Len=0 TSval=2593622339 TSecr=374835762
271   9.838328 10.29.96.106 -> 173.194.203.125 TCP 67 [TCP segment of a reassembled PDU]
272   9.842666 10.29.113.44 -> 10.29.127.255 UDP 82 Source port: 57621  Destination port: 57621
273   9.863016 173.194.203.125 -> 10.29.96.106 TCP 66 5222→60139 [ACK] Seq=1456 Ack=1080 Win=1567 Len=0 TSval=2593622364 TSecr=374835786
274   9.863171 10.29.96.106 -> 173.194.203.125 TCP 67 [TCP segment of a reassembled PDU]
275   9.887956 173.194.203.125 -> 10.29.96.106 TCP 66 5222→60139 [ACK] Seq=1456 Ack=1081 Win=1567 Len=0 TSval=2593622389 TSecr=374835810
276   9.888125 10.29.96.106 -> 173.194.203.125 TCP 67 [TCP segment of a reassembled PDU]
277   9.912771 173.194.203.125 -> 10.29.96.106 TCP 66 5222→60139 [ACK] Seq=1456 Ack=1082 Win=1567 Len=0 TSval=2593622414 TSecr=374835834
278   9.912899 10.29.96.106 -> 173.194.203.125 TCP 67 [TCP segment of a reassembled PDU]
279   9.937589 173.194.203.125 -> 10.29.96.106 TCP 66 5222→60139 [ACK] Seq=1456 Ack=1083 Win=1567 Len=0 TSval=2593622438 TSecr=374835858
280   9.937708 10.29.96.106 -> 173.194.203.125 TCP 67 [TCP segment of a reassembled PDU]
281   9.962470 173.194.203.125 -> 10.29.96.106 TCP 66 5222→60139 [ACK] Seq=1456 Ack=1084 Win=1567 Len=0 TSval=2593622463 TSecr=374835881
282   9.962574 10.29.96.106 -> 173.194.203.125 TCP 67 [TCP segment of a reassembled PDU]
283   9.990479 173.194.203.125 -> 10.29.96.106 TCP 66 5222→60139 [ACK] Seq=1456 Ack=1085 Win=1567 Len=0 TSval=2593622488 TSecr=374835905
284   9.990620 10.29.96.106 -> 173.194.203.125 TCP 67 [TCP segment of a reassembled PDU]
285  10.015437 173.194.203.125 -> 10.29.96.106 TCP 66 5222→60139 [ACK] Seq=1456 Ack=1086 Win=1567 Len=0 TSval=2593622516 TSecr=374835932
286  10.015554 10.29.96.106 -> 173.194.203.125 TCP 67 [TCP segment of a reassembled PDU]
287  10.040329 173.194.203.125 -> 10.29.96.106 TCP 66 5222→60139 [ACK] Seq=1456 Ack=1087 Win=1567 Len=0 TSval=2593622541 TSecr=374835956
288  10.243953  10.29.112.2 -> 224.0.0.18   VRRP 54 Announcement (v2)
289  10.571470 10.29.96.106 -> 173.194.203.188 TCP 54 61608→5228 [ACK] Seq=1 Ack=1 Win=4107 Len=0
290  10.583136 10.29.96.216 -> 239.255.255.250 SSDP 217 M-SEARCH * HTTP/1.1 
291  10.598719 173.194.203.188 -> 10.29.96.106 TCP 66 [TCP ACKed unseen segment] 5228→61608 [ACK] Seq=1 Ack=2 Win=358 Len=0 TSval=2263320073 TSecr=374564326
292  11.000904 172.19.142.9 -> 224.0.0.1    IGMPv2 42 Membership Query, general
293  11.523123   10.29.96.2 -> 224.0.0.18   VRRP 54 Announcement (v2)
294  11.523170 10.29.96.216 -> 239.255.255.250 SSDP 217 M-SEARCH * HTTP/1.1 
295  12.045384  10.29.112.2 -> 224.0.0.18   VRRP 54 Announcement (v2)
296  12.149840  10.29.96.23 -> 224.0.0.251  MDNS 103 Standard query 0x0000  PTR _C54DBC0F._sub._googlecast._tcp.local, "QM" question PTR _googlecast._tcp.local, "QM" question
297  12.567644 10.29.96.216 -> 239.255.255.250 SSDP 217 M-SEARCH * HTTP/1.1 
298  13.403228   10.29.96.2 -> 224.0.0.18   VRRP 54 Announcement (v2)
299  13.421824 10.29.96.106 -> 239.255.255.250 IGMPv2 46 Membership Report group 239.255.255.250
300  13.716566  10.29.112.2 -> 224.0.0.18   VRRP 54 Announcement (v2)
301  13.716608 10.29.113.30 -> 255.255.255.255 DB-LSP-DISC 197 Dropbox LAN sync Discovery Protocol
302  13.716825 10.29.113.30 -> 10.29.127.255 DB-LSP-DISC 197 Dropbox LAN sync Discovery Protocol
303  14.450631 192.30.252.89 -> 10.29.96.106 TLSv1.2 97 [TCP ACKed unseen segment] Application Data
304  14.450714 10.29.96.106 -> 192.30.252.89 TCP 66 [TCP Previous segment not captured] 60803→443 [ACK] Seq=2 Ack=32 Win=4095 Len=0 TSval=374840386 TSecr=652513817
305  14.450834 10.29.96.106 -> 192.30.252.89 TLSv1.2 101 Application Data
306  14.521259 192.30.252.89 -> 10.29.96.106 TCP 66 [TCP ACKed unseen segment] 443→60803 [ACK] Seq=32 Ack=37 Win=31 Len=0 TSval=652513843 TSecr=374840386
307  14.969982   10.29.96.2 -> 224.0.0.18   VRRP 54 Announcement (v2)
308  15.701062  10.29.112.2 -> 224.0.0.18   VRRP 54 Announcement (v2)
309  16.014438  10.29.96.64 -> 10.29.111.255 UDP 86 Source port: 57621  Destination port: 57621
310  16.536630 10.29.113.44 -> 224.0.0.251  MDNS 91 Standard query 0x0000  PTR _airplay._tcp.local, "QU" question PTR _raop._tcp.local, "QU" question
311  16.641060 10.29.113.44 -> 224.0.0.251  MDNS 103 Standard query 0x0000  PTR _CC32E753._sub._googlecast._tcp.local, "QU" question PTR _googlecast._tcp.local, "QU" question
312  16.745546   10.29.96.2 -> 224.0.0.18   VRRP 54 Announcement (v2)
313  17.058913 10.29.113.44 -> 10.29.127.255 UDP 82 Source port: 57621  Destination port: 57621
314  17.058960 10.29.113.44 -> 224.0.0.251  MDNS 126 Standard query 0x0000  PTR _spotify-connect._tcp.local, "QU" question PTR _CC32E753._sub._googlecast._tcp.local, "QU" question PTR _googlecast._tcp.local, "QU" question
315  17.267815  10.29.112.2 -> 224.0.0.18   VRRP 54 Announcement (v2)
316  17.267866 10.29.112.85 -> 224.0.0.251  MDNS 91 Standard query 0x0000  PTR _airplay._tcp.local, "QU" question PTR _raop._tcp.local, "QU" question
317  17.267929 10.29.112.85 -> 224.0.0.251  MDNS 103 Standard query 0x0000  PTR _CC32E753._sub._googlecast._tcp.local, "QU" question PTR _googlecast._tcp.local, "QU" question
318  17.476731 10.29.113.44 -> 224.0.0.251  MDNS 91 Standard query 0x0000  PTR _airplay._tcp.local, "QM" question PTR _raop._tcp.local, "QM" question
319  17.581209 10.29.112.85 -> 10.29.127.255 UDP 82 Source port: 57621  Destination port: 57621
320  17.685625 10.29.112.85 -> 224.0.0.251  MDNS 126 Standard query 0x0000  PTR _spotify-connect._tcp.local, "QU" question PTR _CC32E753._sub._googlecast._tcp.local, "QU" question PTR _googlecast._tcp.local, "QU" question
321  18.207871 10.29.113.44 -> 224.0.0.251  MDNS 126 Standard query 0x0000  PTR _spotify-connect._tcp.local, "QM" question PTR _CC32E753._sub._googlecast._tcp.local, "QM" question PTR _googlecast._tcp.local, "QM" question
322  18.207920 10.29.112.85 -> 224.0.0.251  MDNS 91 Standard query 0x0000  PTR _airplay._tcp.local, "QM" question PTR _raop._tcp.local, "QM" question
323  18.416770 10.29.113.144 -> 255.255.255.255 DB-LSP-DISC 197 Dropbox LAN sync Discovery Protocol
324  18.416848 10.29.113.144 -> 10.29.127.255 DB-LSP-DISC 197 Dropbox LAN sync Discovery Protocol
325  18.625626   10.29.96.2 -> 224.0.0.18   VRRP 54 Announcement (v2)
326  18.730024 10.29.112.85 -> 224.0.0.251  MDNS 126 Standard query 0x0000  PTR _spotify-connect._tcp.local, "QM" question PTR _CC32E753._sub._googlecast._tcp.local, "QM" question PTR _googlecast._tcp.local, "QM" question
327  19.043405 10.29.96.109 -> 255.255.255.255 DB-LSP-DISC 183 Dropbox LAN sync Discovery Protocol
328  19.043556 10.29.96.109 -> 10.29.111.255 DB-LSP-DISC 183 Dropbox LAN sync Discovery Protocol
329  19.147793  10.29.112.2 -> 224.0.0.18   VRRP 54 Announcement (v2)
330  19.670121 10.29.96.109 -> 10.29.111.255 UDP 86 Source port: 57621  Destination port: 57621
331  19.670158 10.29.112.51 -> 10.29.127.255 UDP 86 Source port: 57621  Destination port: 57621
332  19.774578   10.29.96.3 -> 224.0.0.13   PIMv2 78 Hello
333  19.774626   10.29.96.3 -> 224.0.0.13   PIMv2 78 Hello
334  20.192278   10.29.96.2 -> 224.0.0.18   VRRP 54 Announcement (v2)
335  20.296912 10.29.96.159 -> 224.0.0.251  MDNS 128 Standard query response 0x0000  TXT, cache flush
336  20.425910 10.29.96.106 -> 224.0.0.251  IGMPv2 46 Membership Report group 224.0.0.251
337  20.493053 10.29.113.44 -> 224.0.0.251  MDNS 153 Standard query 0x0000  PTR _airplay._tcp.local, "QM" question PTR _raop._tcp.local, "QM" question PTR _spotify-connect._tcp.local, "QM" question PTR _CC32E753._sub._googlecast._tcp.local, "QM" question PTR _googlecast._tcp.local, "QM" question
338  20.923495  10.29.112.2 -> 224.0.0.18   VRRP 54 Announcement (v2)
