  1   0.000000 173.194.202.125 -> 192.168.182.73 TCP 66 5222→51021 [ACK] Seq=1 Ack=1 Win=956 Len=0 TSval=2386359441 TSecr=464651230
  2   0.000132 192.168.182.73 -> 173.194.202.125 TCP 67 [TCP segment of a reassembled PDU]
  3   0.023408 173.194.202.125 -> 192.168.182.73 TCP 66 5222→51021 [ACK] Seq=1 Ack=2 Win=956 Len=0 TSval=2386359464 TSecr=464651253
  4   0.023579 192.168.182.73 -> 173.194.202.125 TCP 67 [TCP segment of a reassembled PDU]
  5   0.046729 173.194.202.125 -> 192.168.182.73 TCP 66 5222→51021 [ACK] Seq=1 Ack=3 Win=956 Len=0 TSval=2386359488 TSecr=464651276
  6   0.046937 192.168.182.73 -> 173.194.202.125 TCP 67 [TCP segment of a reassembled PDU]
  7   0.051931 216.58.217.206 -> 192.168.182.73 TLSv1 711 Application Data
  8   0.052053 216.58.217.206 -> 192.168.182.73 TLSv1 135 Application Data
  9   0.052141 192.168.182.73 -> 216.58.217.206 TCP 66 51324→443 [ACK] Seq=1 Ack=646 Win=4075 Len=0 TSval=464651304 TSecr=570806996
 10   0.052142 192.168.182.73 -> 216.58.217.206 TCP 66 51324→443 [ACK] Seq=1 Ack=715 Win=4073 Len=0 TSval=464651304 TSecr=570806996
 11   0.052421 216.58.217.206 -> 192.168.182.73 TLSv1 1479 Application Data
 12   0.052492 192.168.182.73 -> 216.58.217.206 TCP 66 51324→443 [ACK] Seq=1 Ack=2128 Win=4049 Len=0 TSval=464651304 TSecr=570806997
 13   0.052841 216.58.217.206 -> 192.168.182.73 TLSv1 167 Application Data
 14   0.052878 192.168.182.73 -> 216.58.217.206 TCP 66 51324→443 [ACK] Seq=1 Ack=2229 Win=4046 Len=0 TSval=464651304 TSecr=570806997
 15   0.058052 192.168.182.73 -> 216.58.217.206 TCP 66 51324→443 [FIN, ACK] Seq=1 Ack=2229 Win=4096 Len=0 TSval=464651309 TSecr=570806997
 16   0.064923 192.168.182.73 -> 171.64.1.234 DNS 86 Standard query 0x1e1e  A large-uploads.l.google.com
 17   0.064970 192.168.182.73 -> 171.64.1.234 DNS 86 Standard query 0xf641  AAAA large-uploads.l.google.com
 18   0.066653 171.64.1.234 -> 192.168.182.73 DNS 238 Standard query response 0x1e1e  A 216.58.192.15
 19   0.066693 171.64.1.234 -> 192.168.182.73 DNS 250 Standard query response 0xf641  AAAA 2607:f8b0:4005:801::200f
 20   0.067174 192.168.182.73 -> 216.58.192.15 TCP 78 51325→443 [SYN] Seq=0 Win=65535 Len=0 MSS=1460 WS=32 TSval=464651318 TSecr=0 SACK_PERM=1
 21   0.068003 216.58.217.206 -> 192.168.182.73 TCP 66 443→51324 [FIN, ACK] Seq=2229 Ack=2 Win=350 Len=0 TSval=570807012 TSecr=464651309
 22   0.068120 192.168.182.73 -> 216.58.217.206 TCP 66 51324→443 [ACK] Seq=2 Ack=2230 Win=4096 Len=0 TSval=464651318 TSecr=570807012
 23   0.070142 173.194.202.125 -> 192.168.182.73 TCP 66 5222→51021 [ACK] Seq=1 Ack=4 Win=956 Len=0 TSval=2386359511 TSecr=464651299
 24   0.070179 216.58.192.15 -> 192.168.182.73 TCP 74 443→51325 [SYN, ACK] Seq=0 Ack=1 Win=5000 Len=0 MSS=1430 SACK_PERM=1 TSval=3421692663 TSecr=464651318 WS=128
 25   0.070279 192.168.182.73 -> 216.58.192.15 TCP 66 51325→443 [ACK] Seq=1 Ack=1 Win=131872 Len=0 TSval=464651321 TSecr=3421692663
 26   0.070314 192.168.182.73 -> 173.194.202.125 TCP 67 [TCP segment of a reassembled PDU]
 27   0.070593 192.168.182.73 -> 216.58.192.15 SSL 172 Client Hello
 28   0.073964 216.58.192.15 -> 192.168.182.73 TCP 66 443→51325 [ACK] Seq=1 Ack=107 Win=42624 Len=0 TSval=3421692667 TSecr=464651321
 29   0.075599 216.58.192.15 -> 192.168.182.73 TLSv1 1484 Server Hello
 30   0.075775 216.58.192.15 -> 192.168.182.73 TCP 1484 [TCP segment of a reassembled PDU]
 31   0.075821 192.168.182.73 -> 216.58.192.15 TCP 66 51325→443 [ACK] Seq=107 Ack=2837 Win=129632 Len=0 TSval=464651325 TSecr=3421692667
 32   0.076010 216.58.192.15 -> 192.168.182.73 TLSv1 577 Certificate
 33   0.076067 192.168.182.73 -> 216.58.192.15 TCP 66 51325→443 [ACK] Seq=107 Ack=3348 Win=130560 Len=0 TSval=464651325 TSecr=3421692667
 34   0.077012 192.168.182.73 -> 216.58.192.15 TLSv1 392 Client Key Exchange, Change Cipher Spec, Encrypted Handshake Message
 35   0.081260 216.58.192.15 -> 192.168.182.73 TLSv1 320 New Session Ticket, Change Cipher Spec, Encrypted Handshake Message
 36   0.081343 192.168.182.73 -> 216.58.192.15 TCP 66 51325→443 [ACK] Seq=433 Ack=3602 Win=130816 Len=0 TSval=464651330 TSecr=3421692674
 37   0.081853 192.168.182.73 -> 216.58.192.15 TLSv1 748 Application Data, Application Data
 38   0.082046 192.168.182.73 -> 216.58.192.15 TLSv1 1484 Application Data, Application Data, Application Data, Application Data, Application Data, Application Data, Application Data
 39   0.082046 192.168.182.73 -> 216.58.192.15 TCP 1484 [TCP segment of a reassembled PDU]
 40   0.085139 216.58.192.15 -> 192.168.182.73 TCP 66 443→51325 [ACK] Seq=3602 Ack=2533 Win=47872 Len=0 TSval=3421692678 TSecr=464651330
 41   0.085201 192.168.182.73 -> 216.58.192.15 TCP 1484 [TCP segment of a reassembled PDU]
 42   0.085202 192.168.182.73 -> 216.58.192.15 TLSv1 1484 Application Data
 43   0.085203 192.168.182.73 -> 216.58.192.15 TLSv1 292 Application Data
 44   0.088119 216.58.192.15 -> 192.168.182.73 TCP 66 443→51325 [ACK] Seq=3602 Ack=5369 Win=53504 Len=0 TSval=3421692681 TSecr=464651330
 45   0.088722 216.58.192.15 -> 192.168.182.73 TCP 66 443→51325 [ACK] Seq=3602 Ack=7013 Win=59264 Len=0 TSval=3421692681 TSecr=464651333
 46   0.093910 173.194.202.125 -> 192.168.182.73 TCP 66 5222→51021 [ACK] Seq=1 Ack=5 Win=956 Len=0 TSval=2386359535 TSecr=464651321
 47   0.094079 192.168.182.73 -> 173.194.202.125 TCP 67 [TCP segment of a reassembled PDU]
 48   0.117292 173.194.202.125 -> 192.168.182.73 TCP 66 5222→51021 [ACK] Seq=1 Ack=6 Win=956 Len=0 TSval=2386359558 TSecr=464651340
 49   0.117390 192.168.182.73 -> 173.194.202.125 TCP 67 [TCP segment of a reassembled PDU]
 50   0.140512 173.194.202.125 -> 192.168.182.73 TCP 66 5222→51021 [ACK] Seq=1 Ack=7 Win=956 Len=0 TSval=2386359581 TSecr=464651363
 51   0.140750 192.168.182.73 -> 173.194.202.125 TCP 67 [TCP segment of a reassembled PDU]
 52   0.164476 173.194.202.125 -> 192.168.182.73 TCP 66 5222→51021 [ACK] Seq=1 Ack=8 Win=956 Len=0 TSval=2386359605 TSecr=464651385
 53   0.164716 192.168.182.73 -> 173.194.202.125 TCP 67 [TCP segment of a reassembled PDU]
 54   0.176474 192.168.182.148 -> 192.168.191.255 BJNP 58 Printer Command: Discover
 55   0.177447 192.168.182.148 -> 224.0.0.1    BJNP 58 Printer Command: Discover
 56   0.188030 173.194.202.125 -> 192.168.182.73 TCP 66 5222→51021 [ACK] Seq=1 Ack=9 Win=956 Len=0 TSval=2386359629 TSecr=464651409
 57   0.188255 192.168.182.73 -> 173.194.202.125 TCP 67 [TCP segment of a reassembled PDU]
 58   0.211283 173.194.202.125 -> 192.168.182.73 TCP 66 5222→51021 [ACK] Seq=1 Ack=10 Win=956 Len=0 TSval=2386359652 TSecr=464651431
 59   0.211403 192.168.182.73 -> 173.194.202.125 TCP 67 [TCP segment of a reassembled PDU]
 60   0.234583 173.194.202.125 -> 192.168.182.73 TCP 66 5222→51021 [ACK] Seq=1 Ack=11 Win=956 Len=0 TSval=2386359676 TSecr=464651453
 61   0.234807 192.168.182.73 -> 173.194.202.125 TCP 67 [TCP segment of a reassembled PDU]
 62   0.257893 173.194.202.125 -> 192.168.182.73 TCP 66 5222→51021 [ACK] Seq=1 Ack=12 Win=956 Len=0 TSval=2386359699 TSecr=464651476
 63   0.258010 192.168.182.73 -> 173.194.202.125 TCP 67 [TCP segment of a reassembled PDU]
 64   0.281232 173.194.202.125 -> 192.168.182.73 TCP 66 5222→51021 [ACK] Seq=1 Ack=13 Win=956 Len=0 TSval=2386359722 TSecr=464651499
 65   0.281473 192.168.182.73 -> 173.194.202.125 TCP 67 [TCP segment of a reassembled PDU]
 66   0.304684 173.194.202.125 -> 192.168.182.73 TCP 66 5222→51021 [ACK] Seq=1 Ack=14 Win=956 Len=0 TSval=2386359746 TSecr=464651522
 67   0.305047 192.168.182.73 -> 173.194.202.125 TCP 67 [TCP segment of a reassembled PDU]
 68   0.328126 173.194.202.125 -> 192.168.182.73 TCP 66 5222→51021 [ACK] Seq=1 Ack=15 Win=956 Len=0 TSval=2386359769 TSecr=464651545
 69   0.328369 192.168.182.73 -> 173.194.202.125 TCP 67 [TCP segment of a reassembled PDU]
 70   0.351518 173.194.202.125 -> 192.168.182.73 TCP 66 5222→51021 [ACK] Seq=1 Ack=16 Win=956 Len=0 TSval=2386359793 TSecr=464651567
 71   0.351631 192.168.182.73 -> 173.194.202.125 TCP 67 [TCP segment of a reassembled PDU]
 72   0.374832 173.194.202.125 -> 192.168.182.73 TCP 66 5222→51021 [ACK] Seq=1 Ack=17 Win=956 Len=0 TSval=2386359816 TSecr=464651590
 73   0.375069 192.168.182.73 -> 173.194.202.125 TCP 67 [TCP segment of a reassembled PDU]
 74   0.398246 173.194.202.125 -> 192.168.182.73 TCP 66 5222→51021 [ACK] Seq=1 Ack=18 Win=956 Len=0 TSval=2386359839 TSecr=464651613
 75   0.399270 192.168.182.73 -> 173.194.202.125 TCP 67 [TCP segment of a reassembled PDU]
 76   0.422552 173.194.202.125 -> 192.168.182.73 TCP 66 5222→51021 [ACK] Seq=1 Ack=19 Win=956 Len=0 TSval=2386359863 TSecr=464651636
 77   0.422793 192.168.182.73 -> 173.194.202.125 TCP 67 [TCP segment of a reassembled PDU]
 78   0.445934 173.194.202.125 -> 192.168.182.73 TCP 66 5222→51021 [ACK] Seq=1 Ack=20 Win=956 Len=0 TSval=2386359887 TSecr=464651658
 79   0.446110 192.168.182.73 -> 173.194.202.125 TCP 67 [TCP segment of a reassembled PDU]
 80   0.469503 173.194.202.125 -> 192.168.182.73 TCP 66 5222→51021 [ACK] Seq=1 Ack=21 Win=956 Len=0 TSval=2386359910 TSecr=464651682
 81   0.469750 192.168.182.73 -> 173.194.202.125 TCP 67 [TCP segment of a reassembled PDU]
 82   0.492971 173.194.202.125 -> 192.168.182.73 TCP 66 5222→51021 [ACK] Seq=1 Ack=22 Win=956 Len=0 TSval=2386359934 TSecr=464651705
 83   0.493188 192.168.182.73 -> 173.194.202.125 TCP 67 [TCP segment of a reassembled PDU]
 84   0.516246 173.194.202.125 -> 192.168.182.73 TCP 66 5222→51021 [ACK] Seq=1 Ack=23 Win=956 Len=0 TSval=2386359957 TSecr=464651728
 85   0.516353 192.168.182.73 -> 173.194.202.125 TCP 67 [TCP segment of a reassembled PDU]
 86   0.548460 173.194.202.125 -> 192.168.182.73 TCP 66 5222→51021 [ACK] Seq=1 Ack=24 Win=956 Len=0 TSval=2386359989 TSecr=464651750
 87   0.548695 192.168.182.73 -> 173.194.202.125 TCP 67 [TCP segment of a reassembled PDU]
 88   0.571942 173.194.202.125 -> 192.168.182.73 TCP 66 5222→51021 [ACK] Seq=1 Ack=25 Win=956 Len=0 TSval=2386360013 TSecr=464651782
 89   0.572174 192.168.182.73 -> 173.194.202.125 TCP 67 [TCP segment of a reassembled PDU]
 90   0.595550 173.194.202.125 -> 192.168.182.73 TCP 66 5222→51021 [ACK] Seq=1 Ack=26 Win=956 Len=0 TSval=2386360036 TSecr=464651804
 91   0.595785 192.168.182.73 -> 173.194.202.125 TCP 67 [TCP segment of a reassembled PDU]
 92   0.618965 173.194.202.125 -> 192.168.182.73 TCP 66 5222→51021 [ACK] Seq=1 Ack=27 Win=956 Len=0 TSval=2386360060 TSecr=464651827
 93   0.619074 192.168.182.73 -> 173.194.202.125 TCP 67 [TCP segment of a reassembled PDU]
 94   0.642318 173.194.202.125 -> 192.168.182.73 TCP 66 5222→51021 [ACK] Seq=1 Ack=28 Win=956 Len=0 TSval=2386360083 TSecr=464651849
 95   0.642558 192.168.182.73 -> 173.194.202.125 TCP 67 [TCP segment of a reassembled PDU]
 96   0.665699 173.194.202.125 -> 192.168.182.73 TCP 66 5222→51021 [ACK] Seq=1 Ack=29 Win=956 Len=0 TSval=2386360107 TSecr=464651872
 97   0.665970 192.168.182.73 -> 173.194.202.125 TCP 67 [TCP segment of a reassembled PDU]
 98   0.689096 173.194.202.125 -> 192.168.182.73 TCP 66 5222→51021 [ACK] Seq=1 Ack=30 Win=956 Len=0 TSval=2386360130 TSecr=464651894
 99   0.689348 192.168.182.73 -> 173.194.202.125 TCP 67 [TCP segment of a reassembled PDU]
100   0.712443 173.194.202.125 -> 192.168.182.73 TCP 66 5222→51021 [ACK] Seq=1 Ack=31 Win=956 Len=0 TSval=2386360153 TSecr=464651917
101   0.712563 192.168.182.73 -> 173.194.202.125 TCP 67 [TCP segment of a reassembled PDU]
102   0.735757 173.194.202.125 -> 192.168.182.73 TCP 66 5222→51021 [ACK] Seq=1 Ack=32 Win=956 Len=0 TSval=2386360177 TSecr=464651940
103   0.735931 192.168.182.73 -> 173.194.202.125 TCP 67 [TCP segment of a reassembled PDU]
104   0.759210 173.194.202.125 -> 192.168.182.73 TCP 66 5222→51021 [ACK] Seq=1 Ack=33 Win=956 Len=0 TSval=2386360200 TSecr=464651963
105   0.759427 192.168.182.73 -> 173.194.202.125 TCP 67 [TCP segment of a reassembled PDU]
106   0.782685 173.194.202.125 -> 192.168.182.73 TCP 66 5222→51021 [ACK] Seq=1 Ack=34 Win=956 Len=0 TSval=2386360224 TSecr=464651986
107   0.782898 192.168.182.73 -> 173.194.202.125 TCP 67 [TCP segment of a reassembled PDU]
108   0.790900 192.168.179.129 -> 192.168.191.255 BJNP 60 Printer Command: Discover
109   0.791835 192.168.179.129 -> 224.0.0.1    BJNP 60 Printer Command: Discover
110   0.806100 173.194.202.125 -> 192.168.182.73 TCP 66 5222→51021 [ACK] Seq=1 Ack=35 Win=956 Len=0 TSval=2386360247 TSecr=464652009
111   0.806739 192.168.182.73 -> 173.194.202.125 TCP 67 [TCP segment of a reassembled PDU]
112   0.830001 173.194.202.125 -> 192.168.182.73 TCP 66 5222→51021 [ACK] Seq=1 Ack=36 Win=956 Len=0 TSval=2386360271 TSecr=464652032
113   0.830218 192.168.182.73 -> 173.194.202.125 TCP 67 [TCP segment of a reassembled PDU]
114   0.853463 173.194.202.125 -> 192.168.182.73 TCP 66 5222→51021 [ACK] Seq=1 Ack=37 Win=956 Len=0 TSval=2386360294 TSecr=464652055
115   0.853696 192.168.182.73 -> 173.194.202.125 TCP 67 [TCP segment of a reassembled PDU]
116   0.877505 173.194.202.125 -> 192.168.182.73 TCP 66 5222→51021 [ACK] Seq=1 Ack=38 Win=956 Len=0 TSval=2386360318 TSecr=464652078
117   0.877746 192.168.182.73 -> 173.194.202.125 TCP 67 [TCP segment of a reassembled PDU]
118   0.901357 173.194.202.125 -> 192.168.182.73 TCP 66 5222→51021 [ACK] Seq=1 Ack=39 Win=956 Len=0 TSval=2386360342 TSecr=464652102
119   0.901530 192.168.182.73 -> 173.194.202.125 TCP 67 [TCP segment of a reassembled PDU]
120   0.927852 173.194.202.125 -> 192.168.182.73 TCP 66 5222→51021 [ACK] Seq=1 Ack=40 Win=956 Len=0 TSval=2386360366 TSecr=464652125
121   0.928084 192.168.182.73 -> 173.194.202.125 TCP 67 [TCP segment of a reassembled PDU]
122   0.954796 173.194.202.125 -> 192.168.182.73 TCP 66 5222→51021 [ACK] Seq=1 Ack=41 Win=956 Len=0 TSval=2386360394 TSecr=464652151
123   0.955041 192.168.182.73 -> 173.194.202.125 TCP 67 [TCP segment of a reassembled PDU]
124   0.980919 173.194.202.125 -> 192.168.182.73 TCP 66 5222→51021 [ACK] Seq=1 Ack=42 Win=956 Len=0 TSval=2386360421 TSecr=464652177
125   0.981159 192.168.182.73 -> 173.194.202.125 TCP 67 [TCP segment of a reassembled PDU]
126   1.006888 173.194.202.125 -> 192.168.182.73 TCP 66 5222→51021 [ACK] Seq=1 Ack=43 Win=956 Len=0 TSval=2386360447 TSecr=464652202
127   1.007108 192.168.182.73 -> 173.194.202.125 TCP 67 [TCP segment of a reassembled PDU]
128   1.030333 173.194.202.125 -> 192.168.182.73 TCP 66 5222→51021 [ACK] Seq=1 Ack=44 Win=956 Len=0 TSval=2386360471 TSecr=464652227
129   1.030552 192.168.182.73 -> 173.194.202.125 TCP 67 [TCP segment of a reassembled PDU]
130   1.053939 173.194.202.125 -> 192.168.182.73 TCP 66 5222→51021 [ACK] Seq=1 Ack=45 Win=956 Len=0 TSval=2386360495 TSecr=464652250
131   1.054116 192.168.182.73 -> 173.194.202.125 TCP 67 [TCP segment of a reassembled PDU]
132   1.077367 173.194.202.125 -> 192.168.182.73 TCP 66 5222→51021 [ACK] Seq=1 Ack=46 Win=956 Len=0 TSval=2386360518 TSecr=464652273
133   1.077605 192.168.182.73 -> 173.194.202.125 TCP 67 [TCP segment of a reassembled PDU]
134   1.100866 173.194.202.125 -> 192.168.182.73 TCP 66 5222→51021 [ACK] Seq=1 Ack=47 Win=956 Len=0 TSval=2386360542 TSecr=464652296
135   1.101034 192.168.182.73 -> 173.194.202.125 TCP 67 [TCP segment of a reassembled PDU]
136   1.124328 173.194.202.125 -> 192.168.182.73 TCP 66 5222→51021 [ACK] Seq=1 Ack=48 Win=956 Len=0 TSval=2386360565 TSecr=464652319
137   1.124476 192.168.182.73 -> 173.194.202.125 TCP 67 [TCP segment of a reassembled PDU]
138   1.147757 173.194.202.125 -> 192.168.182.73 TCP 66 5222→51021 [ACK] Seq=1 Ack=49 Win=956 Len=0 TSval=2386360589 TSecr=464652342
139   1.147977 192.168.182.73 -> 173.194.202.125 TCP 67 [TCP segment of a reassembled PDU]
140   1.171507 173.194.202.125 -> 192.168.182.73 TCP 66 5222→51021 [ACK] Seq=1 Ack=50 Win=956 Len=0 TSval=2386360612 TSecr=464652365
141   1.171749 192.168.182.73 -> 173.194.202.125 TCP 67 [TCP segment of a reassembled PDU]
142   1.201623 173.194.202.125 -> 192.168.182.73 TCP 66 5222→51021 [ACK] Seq=1 Ack=51 Win=956 Len=0 TSval=2386360643 TSecr=464652388
143   1.201807 192.168.182.73 -> 173.194.202.125 TCP 67 [TCP segment of a reassembled PDU]
144   1.224999 173.194.202.125 -> 192.168.182.73 TCP 66 5222→51021 [ACK] Seq=1 Ack=52 Win=956 Len=0 TSval=2386360666 TSecr=464652418
145   1.225166 192.168.182.73 -> 173.194.202.125 TCP 67 [TCP segment of a reassembled PDU]
146   1.248603 173.194.202.125 -> 192.168.182.73 TCP 66 5222→51021 [ACK] Seq=1 Ack=53 Win=956 Len=0 TSval=2386360689 TSecr=464652440
147   1.248842 192.168.182.73 -> 173.194.202.125 TCP 67 [TCP segment of a reassembled PDU]
148   1.271995 173.194.202.125 -> 192.168.182.73 TCP 66 5222→51021 [ACK] Seq=1 Ack=54 Win=956 Len=0 TSval=2386360713 TSecr=464652463
149   1.272189 192.168.182.73 -> 173.194.202.125 TCP 67 [TCP segment of a reassembled PDU]
150   1.297008 173.194.202.125 -> 192.168.182.73 TCP 66 5222→51021 [ACK] Seq=1 Ack=55 Win=956 Len=0 TSval=2386360738 TSecr=464652485
151   1.297236 192.168.182.73 -> 173.194.202.125 TCP 67 [TCP segment of a reassembled PDU]
152   1.320385 173.194.202.125 -> 192.168.182.73 TCP 66 5222→51021 [ACK] Seq=1 Ack=56 Win=956 Len=0 TSval=2386360761 TSecr=464652509
153   1.320530 192.168.182.73 -> 173.194.202.125 TCP 67 [TCP segment of a reassembled PDU]
154   1.343713 173.194.202.125 -> 192.168.182.73 TCP 66 5222→51021 [ACK] Seq=1 Ack=57 Win=956 Len=0 TSval=2386360785 TSecr=464652532
155   1.343965 192.168.182.73 -> 173.194.202.125 TCP 67 [TCP segment of a reassembled PDU]
156   1.367221 173.194.202.125 -> 192.168.182.73 TCP 66 5222→51021 [ACK] Seq=1 Ack=58 Win=956 Len=0 TSval=2386360808 TSecr=464652555
157   1.367437 192.168.182.73 -> 173.194.202.125 TCP 67 [TCP segment of a reassembled PDU]
158   1.390643 173.194.202.125 -> 192.168.182.73 TCP 66 5222→51021 [ACK] Seq=1 Ack=59 Win=956 Len=0 TSval=2386360832 TSecr=464652578
159   1.390860 192.168.182.73 -> 173.194.202.125 TCP 67 [TCP segment of a reassembled PDU]
160   1.413961 173.194.202.125 -> 192.168.182.73 TCP 66 5222→51021 [ACK] Seq=1 Ack=60 Win=956 Len=0 TSval=2386360855 TSecr=464652601
161   1.414096 192.168.182.73 -> 173.194.202.125 XMPP/XML 67 UNKNOWN PACKET 
162   1.437236 173.194.202.125 -> 192.168.182.73 TCP 66 5222→51021 [ACK] Seq=1 Ack=61 Win=956 Len=0 TSval=2386360878 TSecr=464652624
163   1.437412 192.168.182.73 -> 173.194.202.125 TCP 67 [TCP segment of a reassembled PDU]
164   1.460516 173.194.202.125 -> 192.168.182.73 TCP 66 5222→51021 [ACK] Seq=1 Ack=62 Win=956 Len=0 TSval=2386360902 TSecr=464652647
165   1.460756 192.168.182.73 -> 173.194.202.125 TCP 67 [TCP segment of a reassembled PDU]
166   1.483959 173.194.202.125 -> 192.168.182.73 TCP 66 5222→51021 [ACK] Seq=1 Ack=63 Win=956 Len=0 TSval=2386360925 TSecr=464652670
167   1.484047 192.168.182.73 -> 173.194.202.125 TCP 67 [TCP segment of a reassembled PDU]
168   1.507135 173.194.202.125 -> 192.168.182.73 TCP 66 5222→51021 [ACK] Seq=1 Ack=64 Win=956 Len=0 TSval=2386360948 TSecr=464652693
169   1.507232 192.168.182.73 -> 173.194.202.125 TCP 67 [TCP segment of a reassembled PDU]
170   1.530446 173.194.202.125 -> 192.168.182.73 TCP 66 5222→51021 [ACK] Seq=1 Ack=65 Win=956 Len=0 TSval=2386360972 TSecr=464652716
171   1.610081 192.168.182.249 -> 192.168.191.255 BJNP 58 Printer Command: Unknown code (2)
172   1.611153 192.168.182.249 -> 224.0.0.1    BJNP 58 Printer Command: Unknown code (2)
173   1.616129 192.168.182.80 -> 224.0.0.251  MDNS 580 Standard query response 0x0000  TXT, cache flush PTR _apple-mobdev2._tcp.local PTR d0:a6:37:71:97:cb@fe80::d2a6:37ff:fe71:97cb._apple-mobdev2._tcp.local PTR d0:a6:37:71:97:cb@fe80::d2a6:37ff:fe71:97cb._apple-mobdev2._tcp.local PTR d0:a6:37:71:97:cb@fe80::d2a6:37ff:fe71:97cb._apple-mobdev2._tcp.local PTR d0:a6:37:71:97:cb@fe80::d2a6:37ff:fe71:97cb._apple-mobdev2._tcp.local PTR d0:a6:37:71:97:cb@fe80::d2a6:37ff:fe71:97cb._apple-mobdev2._tcp.local SRV, cache flush 0 0 32498 i6.local PTR, cache flush i6.local PTR, cache flush i6.local AAAA, cache flush fe80::109b:ed15:8406:b1d A, cache flush 192.168.182.80
174   1.621516 fe80::109b:ed15:8406:b1d -> ff02::fb     MDNS 600 Standard query response 0x0000  TXT, cache flush PTR _apple-mobdev2._tcp.local PTR d0:a6:37:71:97:cb@fe80::d2a6:37ff:fe71:97cb._apple-mobdev2._tcp.local PTR d0:a6:37:71:97:cb@fe80::d2a6:37ff:fe71:97cb._apple-mobdev2._tcp.local PTR d0:a6:37:71:97:cb@fe80::d2a6:37ff:fe71:97cb._apple-mobdev2._tcp.local PTR d0:a6:37:71:97:cb@fe80::d2a6:37ff:fe71:97cb._apple-mobdev2._tcp.local PTR d0:a6:37:71:97:cb@fe80::d2a6:37ff:fe71:97cb._apple-mobdev2._tcp.local SRV, cache flush 0 0 32498 i6.local PTR, cache flush i6.local PTR, cache flush i6.local AAAA, cache flush fe80::109b:ed15:8406:b1d A, cache flush 192.168.182.80
175   2.019644 3com_a8:e8:28 -> Spanning-tree-(for-bridges)_00 STP 60 RST. Root = 32768/0/00:0d:54:a8:e8:20  Cost = 0  Port = 0x8008
176   2.327091 192.168.182.73 -> 216.58.217.206 TCP 78 51326→443 [SYN] Seq=0 Win=65535 Len=0 MSS=1460 WS=32 TSval=464653533 TSecr=0 SACK_PERM=1
177   2.432085 216.58.192.15 -> 192.168.182.73 TLSv1 1479 Application Data
178   2.432191 192.168.182.73 -> 216.58.192.15 TCP 66 51325→443 [ACK] Seq=7013 Ack=5015 Win=129632 Len=0 TSval=464653637 TSecr=3421694919
179   2.432304 216.58.192.15 -> 192.168.182.73 TLSv1 1479 Application Data
180   2.432385 192.168.182.73 -> 216.58.192.15 TCP 66 51325→443 [ACK] Seq=7013 Ack=6428 Win=129632 Len=0 TSval=464653637 TSecr=3421694919
181   2.432448 216.58.192.15 -> 192.168.182.73 TLSv1 1479 Application Data
182   2.432482 192.168.182.73 -> 216.58.192.15 TCP 66 51325→443 [ACK] Seq=7013 Ack=7841 Win=128224 Len=0 TSval=464653637 TSecr=3421694919
183   2.432877 216.58.192.15 -> 192.168.182.73 TLSv1 311 Application Data
184   2.432896 216.58.192.15 -> 192.168.182.73 TLSv1 311 [TCP Retransmission] Application Data
185   2.432929 216.58.217.206 -> 192.168.182.73 TCP 74 443→51326 [SYN, ACK] Seq=0 Ack=1 Win=5000 Len=0 MSS=1430 SACK_PERM=1 TSval=597172306 TSecr=464653533 WS=128
186   2.432945 192.168.182.73 -> 216.58.192.15 TCP 66 51325→443 [ACK] Seq=7013 Ack=8086 Win=128000 Len=0 TSval=464653637 TSecr=3421694919
187   2.432945 192.168.182.73 -> 216.58.192.15 TCP 66 [TCP Dup ACK 186#1] 51325→443 [ACK] Seq=7013 Ack=8086 Win=128000 Len=0 TSval=464653637 TSecr=3421694929
188   2.432993 173.194.202.125 -> 192.168.182.73 TCP 551 [TCP segment of a reassembled PDU]
189   2.433004 192.168.182.73 -> 216.58.217.206 TCP 66 51326→443 [ACK] Seq=1 Ack=1 Win=131872 Len=0 TSval=464653637 TSecr=597172306
190   2.433032 192.168.182.73 -> 173.194.202.125 TCP 66 51021→5222 [ACK] Seq=65 Ack=486 Win=4080 Len=0 TSval=464653637 TSecr=2386361852
191   2.433390 192.168.182.73 -> 216.58.217.206 SSL 168 Client Hello
192   2.438841 192.168.182.73 -> 216.58.192.15 TCP 66 [TCP Window Update] 51325→443 [ACK] Seq=7013 Ack=8086 Win=131072 Len=0 TSval=464653643 TSecr=3421694929
193   2.438954 192.168.182.73 -> 216.58.192.15 TCP 66 51325→443 [FIN, ACK] Seq=7013 Ack=8086 Win=131072 Len=0 TSval=464653643 TSecr=3421694929
194   2.444262 216.58.217.206 -> 192.168.182.73 TCP 66 443→51326 [ACK] Seq=1 Ack=103 Win=42624 Len=0 TSval=597172410 TSecr=464653638
195   2.445914 216.58.217.206 -> 192.168.182.73 TLSv1 1484 Server Hello
196   2.446078 216.58.217.206 -> 192.168.182.73 TCP 1484 [TCP segment of a reassembled PDU]
197   2.446147 192.168.182.73 -> 216.58.217.206 TCP 66 51326→443 [ACK] Seq=103 Ack=2837 Win=129632 Len=0 TSval=464653650 TSecr=597172410
198   2.446362 216.58.217.206 -> 192.168.182.73 TLSv1 1196 Certificate
199   2.446417 192.168.182.73 -> 216.58.217.206 TCP 66 51326→443 [ACK] Seq=103 Ack=3967 Win=129920 Len=0 TSval=464653650 TSecr=597172410
200   2.447164 192.168.182.73 -> 216.58.217.206 TLSv1 392 Client Key Exchange, Change Cipher Spec, Encrypted Handshake Message
201   2.451865 216.58.192.15 -> 192.168.182.73 TCP 66 443→51325 [FIN, ACK] Seq=8086 Ack=7014 Win=59264 Len=0 TSval=3421695044 TSecr=464653643
202   2.451945 192.168.182.73 -> 216.58.192.15 TCP 66 51325→443 [ACK] Seq=7014 Ack=8087 Win=131072 Len=0 TSval=464653655 TSecr=3421695044
203   2.460027 216.58.217.206 -> 192.168.182.73 TLSv1 320 New Session Ticket, Change Cipher Spec, Encrypted Handshake Message
204   2.460212 192.168.182.73 -> 216.58.217.206 TCP 66 51326→443 [ACK] Seq=429 Ack=4221 Win=130816 Len=0 TSval=464653663 TSecr=597172426
205   2.460948 192.168.182.73 -> 216.58.217.206 TLSv1 492 Application Data, Application Data
206   2.512102 216.58.217.206 -> 192.168.182.73 TCP 66 443→51326 [ACK] Seq=4221 Ack=855 Win=44800 Len=0 TSval=597172478 TSecr=464653663
207   2.963011 192.168.182.73 -> 173.194.202.125 TCP 556 [TCP segment of a reassembled PDU]
208   3.046071 216.58.217.206 -> 192.168.182.73 TLSv1 711 Application Data
209   3.046103 216.58.217.206 -> 192.168.182.73 TLSv1 199 Application Data
210   3.046178 192.168.182.73 -> 216.58.217.206 TCP 66 51326→443 [ACK] Seq=855 Ack=4866 Win=130400 Len=0 TSval=464654246 TSecr=597172913
211   3.046218 192.168.182.73 -> 216.58.217.206 TCP 66 51326→443 [ACK] Seq=855 Ack=4999 Win=130272 Len=0 TSval=464654246 TSecr=597172913
212   3.046445 216.58.217.206 -> 192.168.182.73 TLSv1 1447 Application Data
213   3.046447 173.194.202.125 -> 192.168.182.73 TCP 66 5222→51021 [ACK] Seq=486 Ack=555 Win=965 Len=0 TSval=2386362430 TSecr=464654164
214   3.046492 192.168.182.73 -> 216.58.217.206 TCP 66 51326→443 [ACK] Seq=855 Ack=6380 Win=129536 Len=0 TSval=464654246 TSecr=597172914
215   3.050317 192.168.182.73 -> 216.58.217.206 TCP 66 51326→443 [FIN, ACK] Seq=855 Ack=6380 Win=131072 Len=0 TSval=464654249 TSecr=597172914
216   3.058169 192.168.182.73 -> 216.58.192.15 TCP 78 51327→443 [SYN] Seq=0 Win=65535 Len=0 MSS=1460 WS=32 TSval=464654257 TSecr=0 SACK_PERM=1
217   3.060324 216.58.217.206 -> 192.168.182.73 TCP 66 443→51326 [FIN, ACK] Seq=6380 Ack=856 Win=44800 Len=0 TSval=597173026 TSecr=464654249
218   3.060406 192.168.182.73 -> 216.58.217.206 TCP 66 51326→443 [ACK] Seq=856 Ack=6381 Win=131072 Len=0 TSval=464654259 TSecr=597173026
219   3.061022 216.58.192.15 -> 192.168.182.73 TCP 74 443→51327 [SYN, ACK] Seq=0 Ack=1 Win=5000 Len=0 MSS=1430 SACK_PERM=1 TSval=3421365108 TSecr=464654257 WS=128
220   3.061114 192.168.182.73 -> 216.58.192.15 TCP 66 51327→443 [ACK] Seq=1 Ack=1 Win=131872 Len=0 TSval=464654259 TSecr=3421365108
221   3.061380 192.168.182.73 -> 216.58.192.15 SSL 172 Client Hello
222   3.064663 216.58.192.15 -> 192.168.182.73 TCP 66 443→51327 [ACK] Seq=1 Ack=107 Win=42624 Len=0 TSval=3421365112 TSecr=464654259
223   3.066120 216.58.192.15 -> 192.168.182.73 TLSv1 1484 Server Hello
224   3.066444 216.58.192.15 -> 192.168.182.73 TCP 1484 [TCP segment of a reassembled PDU]
225   3.066504 192.168.182.73 -> 216.58.192.15 TCP 66 51327→443 [ACK] Seq=107 Ack=2837 Win=129632 Len=0 TSval=464654264 TSecr=3421365112
226   3.066560 216.58.192.15 -> 192.168.182.73 TLSv1 577 Certificate
227   3.066579 192.168.182.73 -> 216.58.192.15 TCP 66 51327→443 [ACK] Seq=107 Ack=3348 Win=130560 Len=0 TSval=464654264 TSecr=3421365112
228   3.067204 192.168.182.73 -> 216.58.192.15 TLSv1 392 Client Key Exchange, Change Cipher Spec, Encrypted Handshake Message
229   3.071529 216.58.192.15 -> 192.168.182.73 TLSv1 320 New Session Ticket, Change Cipher Spec, Encrypted Handshake Message
230   3.071611 192.168.182.73 -> 216.58.192.15 TCP 66 51327→443 [ACK] Seq=433 Ack=3602 Win=130816 Len=0 TSval=464654269 TSecr=3421365119
231   3.072142 192.168.182.73 -> 216.58.192.15 TLSv1 780 Application Data, Application Data
232   3.072267 192.168.182.73 -> 216.58.192.15 TLSv1 1484 Application Data
233   3.072268 192.168.182.73 -> 216.58.192.15 TCP 1484 [TCP segment of a reassembled PDU]
234   3.075702 216.58.192.15 -> 192.168.182.73 TCP 66 443→51327 [ACK] Seq=3602 Ack=2565 Win=48000 Len=0 TSval=3421365123 TSecr=464654269
235   3.075775 192.168.182.73 -> 216.58.192.15 TCP 1484 [TCP segment of a reassembled PDU]
236   3.075777 192.168.182.73 -> 216.58.192.15 TLSv1 1182 Application Data
237   3.078694 216.58.192.15 -> 192.168.182.73 TCP 66 443→51327 [ACK] Seq=3602 Ack=5401 Win=53632 Len=0 TSval=3421365126 TSecr=464654269
238   3.118380 216.58.192.15 -> 192.168.182.73 TCP 66 443→51327 [ACK] Seq=3602 Ack=6517 Win=56448 Len=0 TSval=3421365166 TSecr=464654273
239   3.862914 192.168.180.63 -> 192.168.191.255 BJNP 58 Scanner Command: Discover
240   3.863847 192.168.180.63 -> 224.0.0.1    BJNP 58 Printer Command: Unknown code (2)
241   3.864676 3com_a8:e8:28 -> Spanning-tree-(for-bridges)_00 STP 60 RST. Root = 32768/0/00:0d:54:a8:e8:20  Cost = 0  Port = 0x8008
242   4.477314 192.168.177.1 -> 192.168.191.255 BJNP 60 Printer Command: Unknown code (2)
243   4.478263 192.168.177.1 -> 224.0.0.1    BJNP 60 Printer Command: Unknown code (2)
244   4.479244 192.168.182.38 -> 192.168.191.255 BJNP 58 Scanner Command: Discover
245   4.480217 192.168.182.38 -> 224.0.0.1    BJNP 58 Printer Command: Unknown code (2)
246   4.682127 192.168.184.146 -> 192.168.191.255 BJNP 60 Scanner Command: Discover
247   4.683031 192.168.184.146 -> 224.0.0.1    BJNP 60 Printer Command: Unknown code (2)
248   4.888115 192.168.180.161 -> 255.255.255.255 DB-LSP-DISC 224 Dropbox LAN sync Discovery Protocol
249   4.890298 192.168.180.161 -> 192.168.191.255 DB-LSP-DISC 224 Dropbox LAN sync Discovery Protocol
250   4.892852 192.168.177.1 -> 255.255.255.255 DB-LSP-DISC 252 Dropbox LAN sync Discovery Protocol
251   4.895325 192.168.177.1 -> 192.168.191.255 DB-LSP-DISC 252 Dropbox LAN sync Discovery Protocol
252   5.302965 216.58.192.15 -> 192.168.182.73 TLSv1 1479 Application Data
253   5.303036 192.168.182.73 -> 216.58.192.15 TCP 66 51327→443 [ACK] Seq=6517 Ack=5015 Win=129632 Len=0 TSval=464656493 TSecr=3421367173
254   5.303217 216.58.192.15 -> 192.168.182.73 TLSv1 1479 Application Data
255   5.303242 192.168.182.73 -> 216.58.192.15 TCP 66 51327→443 [ACK] Seq=6517 Ack=6428 Win=129632 Len=0 TSval=464656493 TSecr=3421367173
256   5.303323 216.58.192.15 -> 192.168.182.73 TLSv1 1479 Application Data
257   5.303358 216.58.192.15 -> 192.168.182.73 TLSv1 487 Application Data
258   5.303365 192.168.182.73 -> 216.58.192.15 TCP 66 51327→443 [ACK] Seq=6517 Ack=7841 Win=128224 Len=0 TSval=464656493 TSecr=3421367173
259   5.303393 216.58.192.15 -> 192.168.182.73 TLSv1 487 [TCP Retransmission] Application Data
260   5.303404 192.168.182.73 -> 216.58.192.15 TCP 66 51327→443 [ACK] Seq=6517 Ack=8262 Win=127808 Len=0 TSval=464656493 TSecr=3421367173
261   5.303411 192.168.182.73 -> 216.58.192.15 TCP 66 [TCP Dup ACK 260#1] 51327→443 [ACK] Seq=6517 Ack=8262 Win=127808 Len=0 TSval=464656493 TSecr=3421367183
262   5.305027 192.168.182.73 -> 216.58.192.15 TCP 66 [TCP Window Update] 51327→443 [ACK] Seq=6517 Ack=8262 Win=131072 Len=0 TSval=464656494 TSecr=3421367183
263   5.305152 192.168.182.73 -> 216.58.192.15 TCP 66 51327→443 [FIN, ACK] Seq=6517 Ack=8262 Win=131072 Len=0 TSval=464656494 TSecr=3421367183
264   5.308238 216.58.192.15 -> 192.168.182.73 TCP 66 443→51327 [FIN, ACK] Seq=8262 Ack=6518 Win=56448 Len=0 TSval=3421367356 TSecr=464656494
265   5.308317 192.168.182.73 -> 216.58.192.15 TCP 66 51327→443 [ACK] Seq=6518 Ack=8263 Win=131072 Len=0 TSval=464656497 TSecr=3421367356
266   5.350214 192.168.182.73 -> 216.58.217.206 TCP 78 51328→443 [SYN] Seq=0 Win=65535 Len=0 MSS=1460 WS=32 TSval=464656538 TSecr=0 SACK_PERM=1
267   5.367628 216.58.217.206 -> 192.168.182.73 TCP 74 443→51328 [SYN, ACK] Seq=0 Ack=1 Win=5000 Len=0 MSS=1430 SACK_PERM=1 TSval=570839855 TSecr=464656538 WS=128
268   5.367728 192.168.182.73 -> 216.58.217.206 TCP 66 51328→443 [ACK] Seq=1 Ack=1 Win=131872 Len=0 TSval=464656555 TSecr=570839855
269   5.367972 192.168.182.73 -> 216.58.217.206 SSL 168 Client Hello
270   5.378589 216.58.217.206 -> 192.168.182.73 TCP 66 443→51328 [ACK] Seq=1 Ack=103 Win=42624 Len=0 TSval=570839866 TSecr=464656555
271   5.379004 192.168.182.73 -> 198.252.206.25 TCP 54 51270→443 [ACK] Seq=1 Ack=1 Win=4096 Len=0
272   5.380670 216.58.217.206 -> 192.168.182.73 TLSv1 1484 Server Hello
273   5.380871 216.58.217.206 -> 192.168.182.73 TCP 1484 [TCP segment of a reassembled PDU]
274   5.380928 192.168.182.73 -> 216.58.217.206 TCP 66 51328→443 [ACK] Seq=103 Ack=2837 Win=129632 Len=0 TSval=464656567 TSecr=570839866
275   5.381203 216.58.217.206 -> 192.168.182.73 TLSv1 1196 Certificate
276   5.381252 192.168.182.73 -> 216.58.217.206 TCP 66 51328→443 [ACK] Seq=103 Ack=3967 Win=129920 Len=0 TSval=464656567 TSecr=570839866
277   5.381968 192.168.182.73 -> 216.58.217.206 TLSv1 392 Client Key Exchange, Change Cipher Spec, Encrypted Handshake Message
278   5.393545 216.58.217.206 -> 192.168.182.73 TLSv1 320 New Session Ticket, Change Cipher Spec, Encrypted Handshake Message
279   5.393631 192.168.182.73 -> 216.58.217.206 TCP 66 51328→443 [ACK] Seq=429 Ack=4221 Win=130816 Len=0 TSval=464656579 TSecr=570839880
280   5.394058 192.168.182.73 -> 216.58.217.206 TLSv1 540 Application Data, Application Data
281   5.443935 216.58.217.206 -> 192.168.182.73 TCP 66 443→51328 [ACK] Seq=4221 Ack=903 Win=44800 Len=0 TSval=570839931 TSecr=464656579
282   5.443975 198.252.206.25 -> 192.168.182.73 TCP 66 [TCP ACKed unseen segment] 443→51270 [ACK] Seq=1 Ack=2 Win=34 Len=0 TSval=1686602562 TSecr=464611169
283   5.503246 192.168.182.72 -> 255.255.255.255 DB-LSP-DISC 309 Dropbox LAN sync Discovery Protocol
284   5.506123 192.168.182.72 -> 192.168.191.255 DB-LSP-DISC 309 Dropbox LAN sync Discovery Protocol
285   5.910774 3com_a8:e8:28 -> Spanning-tree-(for-bridges)_00 STP 60 RST. Root = 32768/0/00:0d:54:a8:e8:20  Cost = 0  Port = 0x8008
286   5.911705 216.58.217.206 -> 192.168.182.73 TLSv1 711 Application Data
287   5.911779 192.168.182.73 -> 216.58.217.206 TCP 66 51328→443 [ACK] Seq=903 Ack=4866 Win=130400 Len=0 TSval=464657095 TSecr=570840273
288   5.912089 216.58.217.206 -> 192.168.182.73 TLSv1 1479 Application Data
289   5.912092 216.58.217.206 -> 192.168.182.73 TLSv1 743 Application Data
290   5.912114 192.168.182.73 -> 216.58.217.206 TCP 66 51328→443 [ACK] Seq=903 Ack=6279 Win=129632 Len=0 TSval=464657095 TSecr=570840273
291   5.912115 192.168.182.73 -> 216.58.217.206 TCP 66 51328→443 [ACK] Seq=903 Ack=6956 Win=128960 Len=0 TSval=464657095 TSecr=570840273
292   5.912360 216.58.217.206 -> 192.168.182.73 TLSv1 743 [TCP Retransmission] Application Data
293   5.912401 192.168.182.73 -> 216.58.217.206 TCP 66 [TCP Dup ACK 291#1] 51328→443 [ACK] Seq=903 Ack=6956 Win=128960 Len=0 TSval=464657095 TSecr=570840295
294   5.914993 192.168.182.73 -> 216.58.217.206 TCP 66 51328→443 [FIN, ACK] Seq=903 Ack=6956 Win=131072 Len=0 TSval=464657097 TSecr=570840295
295   5.924826 216.58.217.206 -> 192.168.182.73 TCP 66 443→51328 [FIN, ACK] Seq=6956 Ack=904 Win=44800 Len=0 TSval=570840412 TSecr=464657097
296   5.924887 192.168.182.73 -> 216.58.217.206 TCP 66 51328→443 [ACK] Seq=904 Ack=6957 Win=131072 Len=0 TSval=464657107 TSecr=570840412
297   5.996553 173.194.202.125 -> 192.168.182.73 TCP 551 [TCP segment of a reassembled PDU]
298   5.996631 192.168.182.73 -> 173.194.202.125 TCP 66 51021→5222 [ACK] Seq=555 Ack=971 Win=4080 Len=0 TSval=464657178 TSecr=2386365437
299   5.996712 173.194.202.125 -> 192.168.182.73 TCP 551 [TCP segment of a reassembled PDU]
300   5.996767 192.168.182.73 -> 173.194.202.125 TCP 66 51021→5222 [ACK] Seq=555 Ack=1456 Win=4065 Len=0 TSval=464657178 TSecr=2386365438
301   6.320489 192.168.189.35 -> 192.168.191.255 BJNP 60 Scanner Command: Discover
302   6.591367 192.168.182.73 -> 173.194.202.125 TCP 588 [TCP segment of a reassembled PDU]
303   6.617340 173.194.202.125 -> 192.168.182.73 TCP 66 5222→51021 [ACK] Seq=1456 Ack=1077 Win=974 Len=0 TSval=2386366058 TSecr=464657770
304   6.935147 192.168.184.201 -> 192.168.191.255 UDP 86 Source port: 57621  Destination port: 57621
305   7.344417 192.168.182.148 -> 192.168.191.255 BJNP 58 Printer Command: Discover
306   7.345446 192.168.182.148 -> 224.0.0.1    BJNP 58 Printer Command: Discover
307   7.958969 192.168.179.129 -> 192.168.191.255 BJNP 60 Printer Command: Discover
308   7.960005 192.168.179.129 -> 224.0.0.1    BJNP 60 Printer Command: Discover
309   7.960792 3com_a8:e8:28 -> Spanning-tree-(for-bridges)_00 STP 60 RST. Root = 32768/0/00:0d:54:a8:e8:20  Cost = 0  Port = 0x8008
310   8.368556 Apple_75:59:e1 -> Broadcast    ARP 60 Who has 192.168.176.1?  Tell 192.168.184.231
311   8.369843 192.168.184.231 -> 224.0.0.251  MDNS 118 Standard query response 0x0000  TXT, cache flush
312   8.371599 fe80::5e:2dd:8879:1f44 -> ff02::fb     MDNS 138 Standard query response 0x0000  TXT, cache flush
313   8.372455 Apple_75:59:e1 -> Broadcast    ARP 60 Who has 192.168.176.1?  Tell 192.168.184.231
314   8.573137 192.168.180.241 -> 224.0.0.2    IGMPv2 46 Leave Group 224.0.0.251
315   8.573986 192.168.180.241 -> 224.0.0.251  IGMPv2 46 Membership Report group 224.0.0.251
316   8.574881 192.168.182.249 -> 192.168.191.255 BJNP 58 Printer Command: Unknown code (2)
317   8.575726 192.168.182.249 -> 224.0.0.1    BJNP 58 Scanner Command: Discover
318   8.778177 192.168.179.255 -> 224.0.0.251  MDNS 78 Standard query 0x0000  PTR _privet._tcp.local, "QM" question
319   8.779522 fe80::1240:f3ff:fea6:7512 -> ff02::fb     MDNS 98 Standard query 0x0000  PTR _privet._tcp.local, "QM" question
320   9.597372 Apple_75:59:e1 -> Broadcast    ARP 60 Who has 192.168.176.1?  Tell 192.168.184.231
321   9.904149 192.168.182.73 -> 173.194.203.188 TCP 54 50949→443 [ACK] Seq=1 Ack=1 Win=4096 Len=0
322   9.930644 173.194.203.188 -> 192.168.182.73 TCP 66 [TCP ACKed unseen segment] 443→50949 [ACK] Seq=1 Ack=2 Win=358 Len=0 TSval=2899499026 TSecr=464525864
323  10.006786 3com_a8:e8:28 -> Spanning-tree-(for-bridges)_00 STP 60 RST. Root = 32768/0/00:0d:54:a8:e8:20  Cost = 0  Port = 0x8008
324  10.213026 192.168.182.249 -> 239.255.255.250 SSDP 217 M-SEARCH * HTTP/1.1 
325  10.417926 192.168.182.235 -> 255.255.255.255 DB-LSP-DISC 228 Dropbox LAN sync Discovery Protocol
326  10.420257 192.168.182.235 -> 192.168.191.255 DB-LSP-DISC 228 Dropbox LAN sync Discovery Protocol
327  10.827567 192.168.183.44 -> 255.255.255.255 DB-LSP-DISC 239 Dropbox LAN sync Discovery Protocol
328  10.830122 192.168.183.44 -> 192.168.191.255 DB-LSP-DISC 239 Dropbox LAN sync Discovery Protocol
329  10.928327 192.168.182.73 -> 216.58.217.206 TCP 78 51329→443 [SYN] Seq=0 Win=65535 Len=0 MSS=1460 WS=32 TSval=464662097 TSecr=0 SACK_PERM=1
330  11.030898 192.168.180.63 -> 192.168.191.255 BJNP 58 Scanner Command: Discover
331  11.031922 192.168.180.63 -> 224.0.0.1    BJNP 58 Scanner Command: Discover
332  11.032366 216.58.217.206 -> 192.168.182.73 TCP 74 443→51329 [SYN, ACK] Seq=0 Ack=1 Win=5000 Len=0 MSS=1430 SACK_PERM=1 TSval=597183908 TSecr=464662097 WS=128
333  11.032436 192.168.182.73 -> 216.58.217.206 TCP 66 51329→443 [ACK] Seq=1 Ack=1 Win=131872 Len=0 TSval=464662200 TSecr=597183908
334  11.032663 192.168.182.73 -> 216.58.217.206 SSL 168 Client Hello
335  11.043372 216.58.217.206 -> 192.168.182.73 TCP 66 443→51329 [ACK] Seq=1 Ack=103 Win=42624 Len=0 TSval=597184011 TSecr=464662200
336  11.045007 216.58.217.206 -> 192.168.182.73 TLSv1 1484 Server Hello
337  11.045248 216.58.217.206 -> 192.168.182.73 TCP 1484 [TCP segment of a reassembled PDU]
338  11.045326 192.168.182.73 -> 216.58.217.206 TCP 66 51329→443 [ACK] Seq=103 Ack=2837 Win=129632 Len=0 TSval=464662212 TSecr=597184011
339  11.045530 216.58.217.206 -> 192.168.182.73 TLSv1 1196 Certificate
340  11.045599 192.168.182.73 -> 216.58.217.206 TCP 66 51329→443 [ACK] Seq=103 Ack=3967 Win=129920 Len=0 TSval=464662212 TSecr=597184011
341  11.046281 192.168.182.73 -> 216.58.217.206 TLSv1 392 Client Key Exchange, Change Cipher Spec, Encrypted Handshake Message
342  11.059258 216.58.217.206 -> 192.168.182.73 TLSv1 320 New Session Ticket, Change Cipher Spec, Encrypted Handshake Message
343  11.059335 192.168.182.73 -> 216.58.217.206 TCP 66 51329→443 [ACK] Seq=429 Ack=4221 Win=130816 Len=0 TSval=464662226 TSecr=597184026
344  11.059774 192.168.182.73 -> 216.58.217.206 TLSv1 540 Application Data, Application Data
345  11.112666 216.58.217.206 -> 192.168.182.73 TCP 66 443→51329 [ACK] Seq=4221 Ack=903 Win=44800 Len=0 TSval=597184080 TSecr=464662226
346  11.236957 192.168.182.249 -> 239.255.255.250 SSDP 217 M-SEARCH * HTTP/1.1 
347  11.440480 192.168.177.1 -> 192.168.191.255 BJNP 60 Printer Command: Unknown code (2)
