1406  49.929482 173.194.203.125 -> 10.29.96.106 TCP 66 5222→60139 [ACK] Seq=4851 Ack=4059 Win=587 Len=0 TSval=2590451132 TSecr=371680127
1407  50.164869 10.29.112.50 -> 10.29.127.255 BROWSER 257 Domain/Workgroup Announcement WORKGROUP, NT Workstation, Domain Enum
1408  50.371292   10.29.96.2 -> 224.0.0.18   VRRP 54 Announcement (v2)
1409  50.570950 10.29.113.100 -> 224.0.0.251  MDNS 120 Standard query 0x0000  PTR _airplay._tcp.local, "QM" question PTR _raop._tcp.local, "QM" question
1410  51.431488 10.29.96.106 -> 239.255.255.250 IGMPv2 46 Membership Report group 239.255.255.250
1411  51.499361  10.29.112.2 -> 224.0.0.18   VRRP 54 Announcement (v2)
1412  51.760948 10.29.96.106 -> 152.163.35.8 TLSv1 103 [TCP Retransmission] Encrypted Alert
1413  52.329072   10.29.96.2 -> 224.0.0.18   VRRP 54 Announcement (v2)
1414  53.060075 10.29.96.109 -> 10.29.111.255 UDP 86 Source port: 57621  Destination port: 57621
1415  53.269013  10.29.96.65 -> 255.255.255.255 DB-LSP-DISC 175 Dropbox LAN sync Discovery Protocol
1416  53.269160  10.29.96.65 -> 10.29.111.255 DB-LSP-DISC 175 Dropbox LAN sync Discovery Protocol
1417  53.373504  10.29.112.2 -> 224.0.0.18   VRRP 54 Announcement (v2)
1418  54.104682   10.29.96.2 -> 224.0.0.18   VRRP 54 Announcement (v2)
1419  55.044742  10.29.112.2 -> 224.0.0.18   VRRP 54 Announcement (v2)
1420  55.253536 10.29.96.151 -> 224.0.0.251  MDNS 210 Standard query response 0x0000  PTR 5c:8d:4e:cf:02:ad@fe80::5e8d:4eff:fecf:2ad._apple-mobdev2._tcp.local PTR 5c:8d:4e:cf:02:ad@fe80::5e8d:4eff:fecf:2ad._apple-mobdev2._tcp.local PTR 5c:8d:4e:cf:02:ad@fe80::5e8d:4eff:fecf:2ad._apple-mobdev2._tcp.local PTR 5c:8d:4e:cf:02:ad@fe80::5e8d:4eff:fecf:2ad._apple-mobdev2._tcp.local
1421  55.411171 10.29.96.106 -> 216.58.193.78 TCP 54 [TCP Dup ACK 195#1] 60683→443 [ACK] Seq=1 Ack=1 Win=4111 Len=0
1422  55.435516 216.58.193.78 -> 10.29.96.106 TCP 66 [TCP Dup ACK 196#1] [TCP ACKed unseen segment] 443→60683 [ACK] Seq=1 Ack=2 Win=341 Len=0 TSval=953607228 TSecr=371550433
1423  55.740346 10.29.96.106 -> 152.163.35.8 TCP 54 60708→995 [RST, ACK] Seq=900 Ack=6075 Win=131072 Len=0
1424  55.775738   10.29.96.2 -> 224.0.0.18   VRRP 54 Announcement (v2)
1425  56.193564   10.29.96.2 -> 224.0.0.13   PIMv2 78 Hello
1426  56.193640   10.29.96.2 -> 224.0.0.13   PIMv2 78 Hello
1427  56.333333 10.29.96.106 -> 216.58.192.1 TCP 54 [TCP Dup ACK 200#1] 60684→80 [ACK] Seq=1 Ack=1 Win=4096 Len=0
1428  56.340617 216.58.192.1 -> 10.29.96.106 TCP 66 [TCP Dup ACK 201#1] [TCP ACKed unseen segment] 80→60684 [ACK] Seq=1 Ack=2 Win=341 Len=0 TSval=3108692982 TSecr=371551592
1429  56.820328  10.29.112.2 -> 224.0.0.18   VRRP 54 Announcement (v2)
1430  57.342603   10.29.96.2 -> 224.0.0.18   VRRP 54 Announcement (v2)
1431  57.342661 10.29.96.151 -> 224.0.0.251  MDNS 256 Standard query 0x0000  ANY 5c:8d:4e:cf:02:ad@fe80::5e8d:4eff:fecf:2ad._apple-mobdev2._tcp.local, "QU" question ANY Molly-Seligmans-iPhone.local, "QU" question ANY Molly-Seligmans-iPhone.local, "QU" question
1432  57.655928 10.29.96.151 -> 224.0.0.251  MDNS 167 Standard query 0x0000  ANY Molly-Seligmans-iPhone.local, "QM" question ANY Molly-Seligmans-iPhone.local, "QM" question
1433  57.885869 10.29.96.106 -> 173.194.203.125 TCP 67 [TCP segment of a reassembled PDU]
1434  57.913285 173.194.203.125 -> 10.29.96.106 TCP 66 5222→60139 [ACK] Seq=4851 Ack=4060 Win=587 Len=0 TSval=2590459170 TSecr=371688153
1435  57.913528 10.29.96.106 -> 173.194.203.125 TCP 67 [TCP segment of a reassembled PDU]
1436  57.938750 173.194.203.125 -> 10.29.96.106 TCP 66 5222→60139 [ACK] Seq=4851 Ack=4061 Win=587 Len=0 TSval=2590459196 TSecr=371688180
1437  57.938999 10.29.96.106 -> 173.194.203.125 TCP 67 [TCP segment of a reassembled PDU]
1438  57.963591 173.194.203.125 -> 10.29.96.106 TCP 66 5222→60139 [ACK] Seq=4851 Ack=4062 Win=587 Len=0 TSval=2590459221 TSecr=371688205
1439  57.963766 10.29.96.106 -> 173.194.203.125 TCP 67 [TCP segment of a reassembled PDU]
1440  57.968531 10.29.96.151 -> 224.0.0.251  MDNS 167 Standard query 0x0000  ANY Molly-Seligmans-iPhone.local, "QM" question ANY Molly-Seligmans-iPhone.local, "QM" question
1441  57.988420 173.194.203.125 -> 10.29.96.106 TCP 66 5222→60139 [ACK] Seq=4851 Ack=4063 Win=587 Len=0 TSval=2590459246 TSecr=371688229
1442  57.988589 10.29.96.106 -> 173.194.203.125 TCP 67 [TCP segment of a reassembled PDU]
1443  58.013236 173.194.203.125 -> 10.29.96.106 TCP 66 5222→60139 [ACK] Seq=4851 Ack=4064 Win=587 Len=0 TSval=2590459271 TSecr=371688253
1444  58.013473 10.29.96.106 -> 173.194.203.125 TCP 67 [TCP segment of a reassembled PDU]
1445  58.038029 173.194.203.125 -> 10.29.96.106 TCP 66 5222→60139 [ACK] Seq=4851 Ack=4065 Win=587 Len=0 TSval=2590459295 TSecr=371688277
1446  58.038178 10.29.96.106 -> 173.194.203.125 TCP 67 [TCP segment of a reassembled PDU]
1447  58.045501 10.29.96.151 -> 224.0.0.251  MDNS 200 Standard query 0x0000  ANY 5c:8d:4e:cf:02:ad@fe80::5e8d:4eff:fecf:2ad._apple-mobdev2._tcp.local, "QU" question
1448  58.062878 173.194.203.125 -> 10.29.96.106 TCP 66 5222→60139 [ACK] Seq=4851 Ack=4066 Win=587 Len=0 TSval=2590459320 TSecr=371688301
1449  58.063049 10.29.96.106 -> 173.194.203.125 TCP 67 [TCP segment of a reassembled PDU]
1450  58.087651 173.194.203.125 -> 10.29.96.106 TCP 66 5222→60139 [ACK] Seq=4851 Ack=4067 Win=587 Len=0 TSval=2590459345 TSecr=371688325
1451  58.087893 10.29.96.106 -> 173.194.203.125 TCP 67 [TCP segment of a reassembled PDU]
1452  58.112526 173.194.203.125 -> 10.29.96.106 TCP 66 5222→60139 [ACK] Seq=4851 Ack=4068 Win=587 Len=0 TSval=2590459370 TSecr=371688349
1453  58.121330 10.29.96.106 -> 173.194.203.125 TCP 67 [TCP segment of a reassembled PDU]
1454  58.145929 173.194.203.125 -> 10.29.96.106 TCP 66 5222→60139 [ACK] Seq=4851 Ack=4069 Win=587 Len=0 TSval=2590459403 TSecr=371688381
1455  58.146174 10.29.96.106 -> 173.194.203.125 TCP 67 [TCP segment of a reassembled PDU]
1456  58.170890 173.194.203.125 -> 10.29.96.106 TCP 66 5222→60139 [ACK] Seq=4851 Ack=4070 Win=587 Len=0 TSval=2590459428 TSecr=371688405
1457  58.171142 10.29.96.106 -> 173.194.203.125 TCP 67 [TCP segment of a reassembled PDU]
1458  58.195803 173.194.203.125 -> 10.29.96.106 TCP 66 5222→60139 [ACK] Seq=4851 Ack=4071 Win=587 Len=0 TSval=2590459453 TSecr=371688429
1459  58.196039 10.29.96.106 -> 173.194.203.125 TCP 67 [TCP segment of a reassembled PDU]
1460  58.198497 10.29.96.151 -> 224.0.0.251  MDNS 268 Standard query response 0x0000  PTR, cache flush Molly-Seligmans-iPhone.local PTR, cache flush Molly-Seligmans-iPhone.local
1461  58.220712 173.194.203.125 -> 10.29.96.106 TCP 66 5222→60139 [ACK] Seq=4851 Ack=4072 Win=587 Len=0 TSval=2590459478 TSecr=371688453
1462  58.220858 10.29.96.106 -> 173.194.203.125 TCP 67 [TCP segment of a reassembled PDU]
1463  58.245963 173.194.203.125 -> 10.29.96.106 TCP 66 5222→60139 [ACK] Seq=4851 Ack=4073 Win=587 Len=0 TSval=2590459503 TSecr=371688477
1464  58.246120 10.29.96.106 -> 173.194.203.125 TCP 67 [TCP segment of a reassembled PDU]
1465  58.270740 173.194.203.125 -> 10.29.96.106 TCP 66 5222→60139 [ACK] Seq=4851 Ack=4074 Win=587 Len=0 TSval=2590459528 TSecr=371688502
1466  58.270919 10.29.96.106 -> 173.194.203.125 TCP 67 [TCP segment of a reassembled PDU]
1467  58.290919 10.29.96.151 -> 224.0.0.251  MDNS 175 Standard query response 0x0000  AAAA, cache flush fe80::100e:9b94:d066:bdb0 A, cache flush 10.29.96.151
1468  58.295495 173.194.203.125 -> 10.29.96.106 TCP 66 5222→60139 [ACK] Seq=4851 Ack=4075 Win=587 Len=0 TSval=2590459553 TSecr=371688526
1469  58.295658 10.29.96.106 -> 173.194.203.125 TCP 67 [TCP segment of a reassembled PDU]
1470  58.299423  10.29.112.2 -> 224.0.0.18   VRRP 54 Announcement (v2)
1471  58.320363 173.194.203.125 -> 10.29.96.106 TCP 66 5222→60139 [ACK] Seq=4851 Ack=4076 Win=587 Len=0 TSval=2590459578 TSecr=371688550
1472  58.320530 10.29.96.106 -> 173.194.203.125 TCP 67 [TCP segment of a reassembled PDU]
1473  58.345294 173.194.203.125 -> 10.29.96.106 TCP 66 5222→60139 [ACK] Seq=4851 Ack=4077 Win=587 Len=0 TSval=2590459603 TSecr=371688574
1474  58.345465 10.29.96.106 -> 173.194.203.125 TCP 67 [TCP segment of a reassembled PDU]
1475  58.370314 173.194.203.125 -> 10.29.96.106 TCP 66 5222→60139 [ACK] Seq=4851 Ack=4078 Win=587 Len=0 TSval=2590459628 TSecr=371688598
1476  58.370488 10.29.96.106 -> 173.194.203.125 TCP 67 [TCP segment of a reassembled PDU]
1477  58.395183 173.194.203.125 -> 10.29.96.106 TCP 66 5222→60139 [ACK] Seq=4851 Ack=4079 Win=587 Len=0 TSval=2590459653 TSecr=371688622
1478  58.395303 10.29.96.106 -> 173.194.203.125 TCP 67 [TCP segment of a reassembled PDU]
1479  58.419918 173.194.203.125 -> 10.29.96.106 TCP 66 5222→60139 [ACK] Seq=4851 Ack=4080 Win=587 Len=0 TSval=2590459677 TSecr=371688646
1480  58.420155 10.29.96.106 -> 173.194.203.125 TCP 67 [TCP segment of a reassembled PDU]
1481  58.445446 173.194.203.125 -> 10.29.96.106 TCP 66 5222→60139 [ACK] Seq=4851 Ack=4081 Win=587 Len=0 TSval=2590459703 TSecr=371688670
1482  58.445675 10.29.96.106 -> 173.194.203.125 TCP 67 [TCP segment of a reassembled PDU]
1483  58.470277 173.194.203.125 -> 10.29.96.106 TCP 66 5222→60139 [ACK] Seq=4851 Ack=4082 Win=587 Len=0 TSval=2590459728 TSecr=371688695
1484  58.470520 10.29.96.106 -> 173.194.203.125 TCP 67 [TCP segment of a reassembled PDU]
1485  58.495223 173.194.203.125 -> 10.29.96.106 TCP 66 5222→60139 [ACK] Seq=4851 Ack=4083 Win=587 Len=0 TSval=2590459753 TSecr=371688719
1486  58.495461 10.29.96.106 -> 173.194.203.125 TCP 67 [TCP segment of a reassembled PDU]
1487  58.520256 173.194.203.125 -> 10.29.96.106 TCP 66 5222→60139 [ACK] Seq=4851 Ack=4084 Win=587 Len=0 TSval=2590459778 TSecr=371688743
1488  58.520492 10.29.96.106 -> 173.194.203.125 TCP 67 [TCP segment of a reassembled PDU]
1489  58.527521 10.29.96.151 -> 224.0.0.251  MDNS 200 Standard query 0x0000  ANY 5c:8d:4e:cf:02:ad@fe80::5e8d:4eff:fecf:2ad._apple-mobdev2._tcp.local, "QM" question
1490  58.545092 173.194.203.125 -> 10.29.96.106 TCP 66 5222→60139 [ACK] Seq=4851 Ack=4085 Win=587 Len=0 TSval=2590459803 TSecr=371688767
1491  58.545337 10.29.96.106 -> 173.194.203.125 TCP 67 [TCP segment of a reassembled PDU]
1492  58.569874 173.194.203.125 -> 10.29.96.106 TCP 66 5222→60139 [ACK] Seq=4851 Ack=4086 Win=587 Len=0 TSval=2590459827 TSecr=371688791
1493  58.569984 10.29.96.106 -> 173.194.203.125 TCP 67 [TCP segment of a reassembled PDU]
1494  58.594759 173.194.203.125 -> 10.29.96.106 TCP 66 5222→60139 [ACK] Seq=4851 Ack=4087 Win=587 Len=0 TSval=2590459852 TSecr=371688814
1495  58.594978 10.29.96.106 -> 173.194.203.125 TCP 67 [TCP segment of a reassembled PDU]
1496  58.619686 173.194.203.125 -> 10.29.96.106 TCP 66 5222→60139 [ACK] Seq=4851 Ack=4088 Win=587 Len=0 TSval=2590459877 TSecr=371688838
1497  58.619910 10.29.96.106 -> 173.194.203.125 TCP 67 [TCP segment of a reassembled PDU]
1498  58.644500 173.194.203.125 -> 10.29.96.106 TCP 66 5222→60139 [ACK] Seq=4851 Ack=4089 Win=587 Len=0 TSval=2590459902 TSecr=371688862
1499  58.644596 10.29.96.106 -> 173.194.203.125 TCP 67 [TCP segment of a reassembled PDU]
1500  58.669137 173.194.203.125 -> 10.29.96.106 TCP 66 5222→60139 [ACK] Seq=4851 Ack=4090 Win=587 Len=0 TSval=2590459927 TSecr=371688886
1501  58.669289 10.29.96.106 -> 173.194.203.125 TCP 67 [TCP segment of a reassembled PDU]
1502  58.736528 173.194.203.125 -> 10.29.96.106 TCP 66 5222→60139 [ACK] Seq=4851 Ack=4091 Win=587 Len=0 TSval=2590459951 TSecr=371688911
1503  58.736712 10.29.96.106 -> 173.194.203.125 TCP 67 [TCP segment of a reassembled PDU]
1504  58.763462 173.194.203.125 -> 10.29.96.106 TCP 66 5222→60139 [ACK] Seq=4851 Ack=4092 Win=587 Len=0 TSval=2590460021 TSecr=371688977
1505  58.763703 10.29.96.106 -> 173.194.203.125 TCP 67 [TCP segment of a reassembled PDU]
1506  58.766873 10.29.96.151 -> 224.0.0.251  MDNS 268 Standard query response 0x0000  PTR, cache flush Molly-Seligmans-iPhone.local PTR, cache flush Molly-Seligmans-iPhone.local
1507  58.788313 173.194.203.125 -> 10.29.96.106 TCP 66 5222→60139 [ACK] Seq=4851 Ack=4093 Win=587 Len=0 TSval=2590460046 TSecr=371689003
1508  58.788412 10.29.96.106 -> 173.194.203.125 TCP 67 [TCP segment of a reassembled PDU]
1509  58.813193 173.194.203.125 -> 10.29.96.106 TCP 66 5222→60139 [ACK] Seq=4851 Ack=4094 Win=587 Len=0 TSval=2590460070 TSecr=371689027
1510  58.813392 10.29.96.106 -> 173.194.203.125 TCP 67 [TCP segment of a reassembled PDU]
1511  58.838136 173.194.203.125 -> 10.29.96.106 TCP 66 5222→60139 [ACK] Seq=4851 Ack=4095 Win=587 Len=0 TSval=2590460095 TSecr=371689051
1512  58.838308 10.29.96.106 -> 173.194.203.125 TCP 67 [TCP segment of a reassembled PDU]
1513  58.847232 10.29.96.151 -> 224.0.0.251  MDNS 200 Standard query 0x0000  ANY 5c:8d:4e:cf:02:ad@fe80::5e8d:4eff:fecf:2ad._apple-mobdev2._tcp.local, "QM" question
1514  58.863057 173.194.203.125 -> 10.29.96.106 TCP 66 5222→60139 [ACK] Seq=4851 Ack=4096 Win=587 Len=0 TSval=2590460120 TSecr=371689075
1515  58.863229 10.29.96.106 -> 173.194.203.125 TCP 67 [TCP segment of a reassembled PDU]
1516  58.888112 173.194.203.125 -> 10.29.96.106 TCP 66 5222→60139 [ACK] Seq=4851 Ack=4097 Win=587 Len=0 TSval=2590460145 TSecr=371689099
1517  58.888289 10.29.96.106 -> 173.194.203.125 TCP 67 [TCP segment of a reassembled PDU]
1518  58.913062 173.194.203.125 -> 10.29.96.106 TCP 66 5222→60139 [ACK] Seq=4851 Ack=4098 Win=587 Len=0 TSval=2590460170 TSecr=371689124
1519  58.913304 10.29.96.106 -> 173.194.203.125 TCP 67 [TCP segment of a reassembled PDU]
1520  58.938010 173.194.203.125 -> 10.29.96.106 TCP 66 5222→60139 [ACK] Seq=4851 Ack=4099 Win=587 Len=0 TSval=2590460195 TSecr=371689148
1521  58.938245 10.29.96.106 -> 173.194.203.125 TCP 67 [TCP segment of a reassembled PDU]
1522  58.962986 173.194.203.125 -> 10.29.96.106 TCP 66 5222→60139 [ACK] Seq=4851 Ack=4100 Win=587 Len=0 TSval=2590460220 TSecr=371689172
1523  58.963162 10.29.96.106 -> 173.194.203.125 TCP 67 [TCP segment of a reassembled PDU]
1524  58.972434   10.29.96.2 -> 224.0.0.18   VRRP 54 Announcement (v2)
1525  58.987973 173.194.203.125 -> 10.29.96.106 TCP 66 5222→60139 [ACK] Seq=4851 Ack=4101 Win=587 Len=0 TSval=2590460245 TSecr=371689196
1526  58.988171 10.29.96.106 -> 173.194.203.125 TCP 67 [TCP segment of a reassembled PDU]
1527  59.012853 173.194.203.125 -> 10.29.96.106 TCP 66 5222→60139 [ACK] Seq=4851 Ack=4102 Win=587 Len=0 TSval=2590460270 TSecr=371689220
1528  59.013080 10.29.96.106 -> 173.194.203.125 TCP 67 [TCP segment of a reassembled PDU]
1529  59.032378 10.29.96.151 -> 224.0.0.251  MDNS 145 Standard query response 0x0000  PTR _apple-mobdev2._tcp.local
1530  59.038498 173.194.203.125 -> 10.29.96.106 TCP 66 5222→60139 [ACK] Seq=4851 Ack=4103 Win=587 Len=0 TSval=2590460296 TSecr=371689244
1531  59.038731 10.29.96.106 -> 173.194.203.125 TCP 67 [TCP segment of a reassembled PDU]
1532  59.063505 173.194.203.125 -> 10.29.96.106 TCP 66 5222→60139 [ACK] Seq=4851 Ack=4104 Win=587 Len=0 TSval=2590460321 TSecr=371689268
1533  59.063675 10.29.96.106 -> 173.194.203.125 TCP 67 [TCP segment of a reassembled PDU]
1534  59.088805 173.194.203.125 -> 10.29.96.106 TCP 66 5222→60139 [ACK] Seq=4851 Ack=4105 Win=587 Len=0 TSval=2590460346 TSecr=371689292
1535  59.088981 10.29.96.106 -> 173.194.203.125 TCP 67 [TCP segment of a reassembled PDU]
1536  59.109326 10.29.96.151 -> 224.0.0.251  MDNS 316 Standard query response 0x0000  TXT, cache flush PTR 5c:8d:4e:cf:02:ad@fe80::5e8d:4eff:fecf:2ad._apple-mobdev2._tcp.local PTR 5c:8d:4e:cf:02:ad@fe80::5e8d:4eff:fecf:2ad._apple-mobdev2._tcp.local PTR 5c:8d:4e:cf:02:ad@fe80::5e8d:4eff:fecf:2ad._apple-mobdev2._tcp.local PTR 5c:8d:4e:cf:02:ad@fe80::5e8d:4eff:fecf:2ad._apple-mobdev2._tcp.local SRV, cache flush 0 0 32498 Molly-Seligmans-iPhone.local
1537  59.113597 173.194.203.125 -> 10.29.96.106 TCP 66 5222→60139 [ACK] Seq=4851 Ack=4106 Win=587 Len=0 TSval=2590460371 TSecr=371689317
1538  59.113838 10.29.96.106 -> 173.194.203.125 TCP 67 [TCP segment of a reassembled PDU]
1539  59.138537 173.194.203.125 -> 10.29.96.106 TCP 66 5222→60139 [ACK] Seq=4851 Ack=4107 Win=587 Len=0 TSval=2590460396 TSecr=371689341
1540  59.138773 10.29.96.106 -> 173.194.203.125 TCP 67 [TCP segment of a reassembled PDU]
1541  59.163723 173.194.203.125 -> 10.29.96.106 TCP 66 5222→60139 [ACK] Seq=4851 Ack=4108 Win=587 Len=0 TSval=2590460421 TSecr=371689365
1542  59.163955 10.29.96.106 -> 173.194.203.125 TCP 67 [TCP segment of a reassembled PDU]
1543  59.188703 173.194.203.125 -> 10.29.96.106 TCP 66 5222→60139 [ACK] Seq=4851 Ack=4109 Win=587 Len=0 TSval=2590460446 TSecr=371689390
1544  59.188877 10.29.96.106 -> 173.194.203.125 TCP 67 [TCP segment of a reassembled PDU]
1545  59.213502 173.194.203.125 -> 10.29.96.106 TCP 66 5222→60139 [ACK] Seq=4851 Ack=4110 Win=587 Len=0 TSval=2590460471 TSecr=371689414
1546  59.213633 10.29.96.106 -> 173.194.203.125 TCP 67 [TCP segment of a reassembled PDU]
1547  59.238275 173.194.203.125 -> 10.29.96.106 TCP 66 5222→60139 [ACK] Seq=4851 Ack=4111 Win=587 Len=0 TSval=2590460496 TSecr=371689438
1548  59.238421 10.29.96.106 -> 173.194.203.125 TCP 67 [TCP segment of a reassembled PDU]
1549  59.262906 173.194.203.125 -> 10.29.96.106 TCP 66 5222→60139 [ACK] Seq=4851 Ack=4112 Win=587 Len=0 TSval=2590460520 TSecr=371689463
1550  59.263012 10.29.96.106 -> 173.194.203.125 TCP 67 [TCP segment of a reassembled PDU]
1551  59.287963 173.194.203.125 -> 10.29.96.106 TCP 66 5222→60139 [ACK] Seq=4851 Ack=4113 Win=587 Len=0 TSval=2590460545 TSecr=371689487
1552  59.288202 10.29.96.106 -> 173.194.203.125 TCP 67 [TCP segment of a reassembled PDU]
1553  59.312899 173.194.203.125 -> 10.29.96.106 TCP 66 5222→60139 [ACK] Seq=4851 Ack=4114 Win=587 Len=0 TSval=2590460570 TSecr=371689512
1554  59.313135 10.29.96.106 -> 173.194.203.125 TCP 67 [TCP segment of a reassembled PDU]
1555  59.337810 173.194.203.125 -> 10.29.96.106 TCP 66 5222→60139 [ACK] Seq=4851 Ack=4115 Win=587 Len=0 TSval=2590460595 TSecr=371689536
1556  59.338049 10.29.96.106 -> 173.194.203.125 TCP 67 [TCP segment of a reassembled PDU]
1557  59.362812 173.194.203.125 -> 10.29.96.106 TCP 66 5222→60139 [ACK] Seq=4851 Ack=4116 Win=587 Len=0 TSval=2590460620 TSecr=371689560
1558  59.363054 10.29.96.106 -> 173.194.203.125 TCP 67 [TCP segment of a reassembled PDU]
1559  59.387780 173.194.203.125 -> 10.29.96.106 TCP 66 5222→60139 [ACK] Seq=4851 Ack=4117 Win=587 Len=0 TSval=2590460645 TSecr=371689585
1560  59.387954 10.29.96.106 -> 173.194.203.125 TCP 67 [TCP segment of a reassembled PDU]
1561  59.412630 173.194.203.125 -> 10.29.96.106 TCP 66 5222→60139 [ACK] Seq=4851 Ack=4118 Win=587 Len=0 TSval=2590460670 TSecr=371689609
1562  59.412869 10.29.96.106 -> 173.194.203.125 TCP 67 [TCP segment of a reassembled PDU]
1563  59.423385 10.29.96.151 -> 224.0.0.251  MDNS 175 Standard query response 0x0000  AAAA, cache flush fe80::100e:9b94:d066:bdb0 A, cache flush 10.29.96.151
1564  59.437566 173.194.203.125 -> 10.29.96.106 TCP 66 5222→60139 [ACK] Seq=4851 Ack=4119 Win=587 Len=0 TSval=2590460695 TSecr=371689633
1565  59.437810 10.29.96.106 -> 173.194.203.125 TCP 67 [TCP segment of a reassembled PDU]
1566  59.463858 173.194.203.125 -> 10.29.96.106 TCP 66 5222→60139 [ACK] Seq=4851 Ack=4120 Win=587 Len=0 TSval=2590460720 TSecr=371689658
1567  59.464031 10.29.96.106 -> 173.194.203.125 TCP 67 [TCP segment of a reassembled PDU]
1568  59.488678 173.194.203.125 -> 10.29.96.106 TCP 66 5222→60139 [ACK] Seq=4851 Ack=4121 Win=587 Len=0 TSval=2590460746 TSecr=371689684
1569  59.488771 10.29.96.106 -> 173.194.203.125 TCP 67 [TCP segment of a reassembled PDU]
1570  59.513615 173.194.203.125 -> 10.29.96.106 TCP 66 5222→60139 [ACK] Seq=4851 Ack=4122 Win=587 Len=0 TSval=2590460771 TSecr=371689708
1571  59.513831 10.29.96.106 -> 173.194.203.125 TCP 67 [TCP segment of a reassembled PDU]
1572  59.538482 173.194.203.125 -> 10.29.96.106 TCP 66 5222→60139 [ACK] Seq=4851 Ack=4123 Win=587 Len=0 TSval=2590460796 TSecr=371689732
1573  59.538698 10.29.96.106 -> 173.194.203.125 TCP 67 [TCP segment of a reassembled PDU]
1574  59.563399 173.194.203.125 -> 10.29.96.106 TCP 66 5222→60139 [ACK] Seq=4851 Ack=4124 Win=587 Len=0 TSval=2590460821 TSecr=371689756
1575  59.563575 10.29.96.106 -> 173.194.203.125 TCP 67 [TCP segment of a reassembled PDU]
1576  59.568370 10.29.112.51 -> 10.29.127.255 UDP 86 Source port: 57621  Destination port: 57621
1577  59.588212 173.194.203.125 -> 10.29.96.106 TCP 66 5222→60139 [ACK] Seq=4851 Ack=4125 Win=587 Len=0 TSval=2590460846 TSecr=371689780
1578  59.588386 10.29.96.106 -> 173.194.203.125 TCP 67 [TCP segment of a reassembled PDU]
1579  59.612981 173.194.203.125 -> 10.29.96.106 TCP 66 5222→60139 [ACK] Seq=4851 Ack=4126 Win=587 Len=0 TSval=2590460870 TSecr=371689804
1580  59.613364 10.29.96.106 -> 173.194.203.125 TCP 67 [TCP segment of a reassembled PDU]
1581  59.638168 173.194.203.125 -> 10.29.96.106 TCP 66 5222→60139 [ACK] Seq=4851 Ack=4127 Win=587 Len=0 TSval=2590460895 TSecr=371689828
1582  59.638270 10.29.96.106 -> 173.194.203.125 TCP 67 [TCP segment of a reassembled PDU]
1583  59.662948 173.194.203.125 -> 10.29.96.106 TCP 66 5222→60139 [ACK] Seq=4851 Ack=4128 Win=587 Len=0 TSval=2590460920 TSecr=371689853
1584  59.663120 10.29.96.106 -> 173.194.203.125 TCP 67 [TCP segment of a reassembled PDU]
1585  59.687609 173.194.203.125 -> 10.29.96.106 TCP 66 5222→60139 [ACK] Seq=4851 Ack=4129 Win=587 Len=0 TSval=2590460945 TSecr=371689876
1586  59.687699 10.29.96.106 -> 173.194.203.125 TCP 67 [TCP segment of a reassembled PDU]
1587  59.712445 173.194.203.125 -> 10.29.96.106 TCP 66 5222→60139 [ACK] Seq=4851 Ack=4130 Win=587 Len=0 TSval=2590460970 TSecr=371689900
1588  59.712607 10.29.96.106 -> 173.194.203.125 TCP 67 [TCP segment of a reassembled PDU]
1589  59.737315 173.194.203.125 -> 10.29.96.106 TCP 66 5222→60139 [ACK] Seq=4851 Ack=4131 Win=587 Len=0 TSval=2590460995 TSecr=371689925
1590  59.737465 10.29.96.106 -> 173.194.203.125 TCP 67 [TCP segment of a reassembled PDU]
1591  59.762032 173.194.203.125 -> 10.29.96.106 TCP 66 5222→60139 [ACK] Seq=4851 Ack=4132 Win=587 Len=0 TSval=2590461019 TSecr=371689950
1592  59.762200 10.29.96.106 -> 173.194.203.125 TCP 67 [TCP segment of a reassembled PDU]
1593  59.786942 173.194.203.125 -> 10.29.96.106 TCP 66 5222→60139 [ACK] Seq=4851 Ack=4133 Win=587 Len=0 TSval=2590461044 TSecr=371689973
1594  59.827846  10.29.112.2 -> 224.0.0.18   VRRP 54 Announcement (v2)
1595  60.058298 10.29.96.151 -> 224.0.0.251  MDNS 353 Standard query response 0x0000  TXT, cache flush PTR _apple-mobdev2._tcp.local PTR 5c:8d:4e:cf:02:ad@fe80::5e8d:4eff:fecf:2ad._apple-mobdev2._tcp.local PTR 5c:8d:4e:cf:02:ad@fe80::5e8d:4eff:fecf:2ad._apple-mobdev2._tcp.local PTR 5c:8d:4e:cf:02:ad@fe80::5e8d:4eff:fecf:2ad._apple-mobdev2._tcp.local PTR 5c:8d:4e:cf:02:ad@fe80::5e8d:4eff:fecf:2ad._apple-mobdev2._tcp.local SRV, cache flush 0 0 32498 Molly-Seligmans-iPhone.local
1596  60.328072 10.29.96.106 -> 171.64.1.234 DNS 80 Standard query 0xc9fd  A clients.l.google.com
1597  60.328203 10.29.96.106 -> 171.64.1.234 DNS 80 Standard query 0x5b1c  AAAA clients.l.google.com
1598  60.331659 171.64.1.234 -> 10.29.96.106 DNS 232 Standard query response 0xc9fd  A 216.58.193.78
1599  60.331858 171.64.1.234 -> 10.29.96.106 DNS 244 Standard query response 0x5b1c  AAAA 2607:f8b0:400a:800::200e
1600  60.332203 10.29.96.106 -> 216.58.193.78 TCP 78 60723→443 [SYN] Seq=0 Win=65535 Len=0 MSS=1460 WS=32 TSval=371690538 TSecr=0 SACK_PERM=1
1601  60.332499 10.29.96.106 -> 216.58.193.78 TCP 78 60724→443 [SYN] Seq=0 Win=65535 Len=0 MSS=1460 WS=32 TSval=371690538 TSecr=0 SACK_PERM=1
1602  60.354069 216.58.193.78 -> 10.29.96.106 TCP 74 443→60723 [SYN, ACK] Seq=0 Ack=1 Win=42540 Len=0 MSS=1430 SACK_PERM=1 TSval=895560725 TSecr=371690538 WS=128
1603  60.354251 10.29.96.106 -> 216.58.193.78 TCP 66 60723→443 [ACK] Seq=1 Ack=1 Win=131872 Len=0 TSval=371690560 TSecr=895560725
1604  60.354345 216.58.193.78 -> 10.29.96.106 TCP 74 443→60724 [SYN, ACK] Seq=0 Ack=1 Win=42540 Len=0 MSS=1430 SACK_PERM=1 TSval=913904384 TSecr=371690538 WS=128
1605  60.354459 10.29.96.106 -> 216.58.193.78 TCP 66 60724→443 [ACK] Seq=1 Ack=1 Win=131872 Len=0 TSval=371690560 TSecr=913904384
1606  60.354741 10.29.96.106 -> 216.58.193.78 SSL 168 Client Hello
1607  60.354837 10.29.96.106 -> 216.58.193.78 SSL 168 Client Hello
1608  60.376670 216.58.193.78 -> 10.29.96.106 TCP 66 443→60723 [ACK] Seq=1 Ack=103 Win=42624 Len=0 TSval=895560748 TSecr=371690560
1609  60.376709 216.58.193.78 -> 10.29.96.106 TCP 66 443→60724 [ACK] Seq=1 Ack=103 Win=42624 Len=0 TSval=913904406 TSecr=371690560
1610  60.377091 216.58.193.78 -> 10.29.96.106 TLSv1 1484 Server Hello
1611  60.377098 216.58.193.78 -> 10.29.96.106 TCP 1484 [TCP segment of a reassembled PDU]
1612  60.377100 216.58.193.78 -> 10.29.96.106 TLSv1 1196 Certificate
1613  60.377101 216.58.193.78 -> 10.29.96.106 TLSv1 1484 Server Hello
1614  60.377102 216.58.193.78 -> 10.29.96.106 TCP 1484 [TCP segment of a reassembled PDU]
1615  60.377136 216.58.193.78 -> 10.29.96.106 TLSv1 1196 Certificate
1616  60.377225 10.29.96.106 -> 216.58.193.78 TCP 66 60724→443 [ACK] Seq=103 Ack=2837 Win=129024 Len=0 TSval=371690581 TSecr=913904406
1617  60.377225 10.29.96.106 -> 216.58.193.78 TCP 66 60724→443 [ACK] Seq=103 Ack=3967 Win=127904 Len=0 TSval=371690581 TSecr=913904406
1618  60.377307 10.29.96.106 -> 216.58.193.78 TCP 66 60723→443 [ACK] Seq=103 Ack=2837 Win=129024 Len=0 TSval=371690581 TSecr=895560748
1619  60.377308 10.29.96.106 -> 216.58.193.78 TCP 66 60723→443 [ACK] Seq=103 Ack=3967 Win=127904 Len=0 TSval=371690581 TSecr=895560748
1620  60.377411 10.29.96.106 -> 216.58.193.78 TCP 66 [TCP Window Update] 60724→443 [ACK] Seq=103 Ack=3967 Win=131040 Len=0 TSval=371690581 TSecr=913904406
1621  60.377412 10.29.96.106 -> 216.58.193.78 TCP 66 [TCP Window Update] 60723→443 [ACK] Seq=103 Ack=3967 Win=131040 Len=0 TSval=371690581 TSecr=895560748
1622  60.378354 10.29.96.106 -> 216.58.193.78 TLSv1 392 Client Key Exchange, Change Cipher Spec, Encrypted Handshake Message
1623  60.378426 10.29.96.106 -> 216.58.193.78 TLSv1 392 Client Key Exchange, Change Cipher Spec, Encrypted Handshake Message
1624  60.401094 216.58.193.78 -> 10.29.96.106 TLSv1 320 New Session Ticket, Change Cipher Spec, Encrypted Handshake Message
1625  60.401191 216.58.193.78 -> 10.29.96.106 TLSv1 320 New Session Ticket, Change Cipher Spec, Encrypted Handshake Message
1626  60.401224 10.29.96.106 -> 216.58.193.78 TCP 66 60724→443 [ACK] Seq=429 Ack=4221 Win=130816 Len=0 TSval=371690605 TSecr=913904430
1627  60.401306 10.29.96.106 -> 216.58.193.78 TCP 66 60723→443 [ACK] Seq=429 Ack=4221 Win=130816 Len=0 TSval=371690605 TSecr=895560773
1628  60.402136 10.29.96.106 -> 216.58.193.78 TLSv1 492 Application Data, Application Data
1629  60.402137 10.29.96.106 -> 216.58.193.78 TLSv1 492 Application Data, Application Data
1630  60.465853 216.58.193.78 -> 10.29.96.106 TCP 66 443→60723 [ACK] Seq=4221 Ack=855 Win=44800 Len=0 TSval=895560837 TSecr=371690605
1631  60.465860 216.58.193.78 -> 10.29.96.106 TCP 66 443→60724 [ACK] Seq=4221 Ack=855 Win=44800 Len=0 TSval=913904495 TSecr=371690605
1632  60.556029 216.58.193.78 -> 10.29.96.106 TLSv1 711 Application Data
1633  60.556104 10.29.96.106 -> 216.58.193.78 TCP 66 60723→443 [ACK] Seq=855 Ack=4866 Win=130400 Len=0 TSval=371690758 TSecr=895560927
1634  60.556638 216.58.193.78 -> 10.29.96.106 TLSv1 119 Application Data
1635  60.556681 10.29.96.106 -> 216.58.193.78 TCP 66 60723→443 [ACK] Seq=855 Ack=4919 Win=131008 Len=0 TSval=371690758 TSecr=895560928
1636  60.556808 216.58.193.78 -> 10.29.96.106 TLSv1 1479 Application Data
1637  60.556845 10.29.96.106 -> 216.58.193.78 TCP 66 60723→443 [ACK] Seq=855 Ack=6332 Win=129600 Len=0 TSval=371690758 TSecr=895560928
1638  60.557002 216.58.193.78 -> 10.29.96.106 TLSv1 151 Application Data
1639  60.557039 10.29.96.106 -> 216.58.193.78 TCP 66 60723→443 [ACK] Seq=855 Ack=6417 Win=129504 Len=0 TSval=371690758 TSecr=895560928
1640  60.560771 216.58.193.78 -> 10.29.96.106 TLSv1 711 Application Data
1641  60.560813 10.29.96.106 -> 216.58.193.78 TCP 66 60724→443 [ACK] Seq=855 Ack=4866 Win=130400 Len=0 TSval=371690761 TSecr=913904590
1642  60.560926 216.58.193.78 -> 10.29.96.106 TLSv1 135 Application Data
1643  60.560939 10.29.96.106 -> 216.58.193.78 TCP 66 60723→443 [FIN, ACK] Seq=855 Ack=6417 Win=131072 Len=0 TSval=371690761 TSecr=895560928
1644  60.560961 10.29.96.106 -> 216.58.193.78 TCP 66 60724→443 [ACK] Seq=855 Ack=4935 Win=130336 Len=0 TSval=371690762 TSecr=913904590
1645  60.561489 216.58.193.78 -> 10.29.96.106 TLSv1 1479 Application Data
1646  60.561519 10.29.96.106 -> 216.58.193.78 TCP 66 60724→443 [ACK] Seq=855 Ack=6348 Win=129568 Len=0 TSval=371690762 TSecr=913904591
1647  60.561658 216.58.193.78 -> 10.29.96.106 TLSv1 247 Application Data
1648  60.561681 10.29.96.106 -> 216.58.193.78 TCP 66 60724→443 [ACK] Seq=855 Ack=6529 Win=129408 Len=0 TSval=371690762 TSecr=913904591
1649  60.574340 10.29.96.106 -> 216.58.193.78 TCP 66 60724→443 [FIN, ACK] Seq=855 Ack=6529 Win=131072 Len=0 TSval=371690774 TSecr=913904591
1650  60.581271 10.29.96.106 -> 216.58.192.15 TCP 78 60725→443 [SYN] Seq=0 Win=65535 Len=0 MSS=1460 WS=32 TSval=371690780 TSecr=0 SACK_PERM=1
1651  60.583342 216.58.193.78 -> 10.29.96.106 TCP 66 443→60723 [FIN, ACK] Seq=6417 Ack=856 Win=44800 Len=0 TSval=895560955 TSecr=371690761
1652  60.583377 10.29.96.106 -> 216.58.193.78 TCP 66 60723→443 [ACK] Seq=856 Ack=6418 Win=131072 Len=0 TSval=371690782 TSecr=895560955
1653  60.586017 216.58.192.15 -> 10.29.96.106 TCP 74 443→60725 [SYN, ACK] Seq=0 Ack=1 Win=42540 Len=0 MSS=1430 SACK_PERM=1 TSval=3108697169 TSecr=371690780 WS=128
1654  60.586061 10.29.96.106 -> 216.58.192.15 TCP 66 60725→443 [ACK] Seq=1 Ack=1 Win=131872 Len=0 TSval=371690784 TSecr=3108697169
1655  60.586229 10.29.96.106 -> 216.58.192.15 SSL 172 Client Hello
1656  60.590148 10.29.96.106 -> 216.58.192.15 TCP 78 60726→443 [SYN] Seq=0 Win=65535 Len=0 MSS=1460 WS=32 TSval=371690788 TSecr=0 SACK_PERM=1
1657  60.591743 216.58.192.15 -> 10.29.96.106 TCP 66 443→60725 [ACK] Seq=1 Ack=107 Win=42624 Len=0 TSval=3108697174 TSecr=371690784
1658  60.592309 216.58.192.15 -> 10.29.96.106 TLSv1 1484 Server Hello
1659  60.592394 216.58.192.15 -> 10.29.96.106 TCP 1484 [TCP segment of a reassembled PDU]
1660  60.592460 10.29.96.106 -> 216.58.192.15 TCP 66 60725→443 [ACK] Seq=107 Ack=2837 Win=129024 Len=0 TSval=371690789 TSecr=3108697175
1661  60.592678 216.58.192.15 -> 10.29.96.106 TLSv1 577 Certificate
1662  60.592735 10.29.96.106 -> 216.58.192.15 TCP 66 60725→443 [ACK] Seq=107 Ack=3348 Win=130560 Len=0 TSval=371690789 TSecr=3108697175
1663  60.593467 10.29.96.106 -> 216.58.192.15 TLSv1 392 Client Key Exchange, Change Cipher Spec, Encrypted Handshake Message
1664  60.596071 216.58.192.15 -> 10.29.96.106 TCP 74 443→60726 [SYN, ACK] Seq=0 Ack=1 Win=42540 Len=0 MSS=1430 SACK_PERM=1 TSval=3108697399 TSecr=371690788 WS=128
1665  60.596149 216.58.193.78 -> 10.29.96.106 TCP 66 443→60724 [FIN, ACK] Seq=6529 Ack=856 Win=44800 Len=0 TSval=913904625 TSecr=371690774
1666  60.596171 10.29.96.106 -> 216.58.192.15 TCP 66 60726→443 [ACK] Seq=1 Ack=1 Win=131872 Len=0 TSval=371690792 TSecr=3108697399
1667  60.596228 10.29.96.106 -> 216.58.193.78 TCP 66 60724→443 [ACK] Seq=856 Ack=6530 Win=131072 Len=0 TSval=371690792 TSecr=913904625
1668  60.596471 10.29.96.106 -> 216.58.192.15 SSL 172 Client Hello
1669  60.599761 216.58.192.15 -> 10.29.96.106 TLSv1 320 New Session Ticket, Change Cipher Spec, Encrypted Handshake Message
1670  60.599852 10.29.96.106 -> 216.58.192.15 TCP 66 60725→443 [ACK] Seq=433 Ack=3602 Win=130816 Len=0 TSval=371690795 TSecr=3108697182
1671  60.600346 10.29.96.106 -> 216.58.192.15 TLSv1 780 Application Data, Application Data
1672  60.600374 10.29.96.106 -> 216.58.192.15 TLSv1 1484 Application Data
1673  60.600374 10.29.96.106 -> 216.58.192.15 TCP 1484 [TCP segment of a reassembled PDU]
1674  60.601836 216.58.192.15 -> 10.29.96.106 TCP 66 443→60726 [ACK] Seq=1 Ack=107 Win=42624 Len=0 TSval=3108697406 TSecr=371690792
1675  60.601916 216.58.192.15 -> 10.29.96.106 TLSv1 1484 Server Hello
1676  60.602024 216.58.192.15 -> 10.29.96.106 TCP 1484 [TCP segment of a reassembled PDU]
1677  60.602030 216.58.192.15 -> 10.29.96.106 TLSv1 577 Certificate
1678  60.602080 10.29.96.106 -> 216.58.192.15 TCP 66 60726→443 [ACK] Seq=107 Ack=2837 Win=129024 Len=0 TSval=371690797 TSecr=3108697406
1679  60.602080 10.29.96.106 -> 216.58.192.15 TCP 66 60726→443 [ACK] Seq=107 Ack=3348 Win=128512 Len=0 TSval=371690797 TSecr=3108697406
1680  60.602741 10.29.96.106 -> 216.58.192.15 TLSv1 392 Client Key Exchange, Change Cipher Spec, Encrypted Handshake Message
1681  60.605716 216.58.192.15 -> 10.29.96.106 TCP 66 443→60725 [ACK] Seq=3602 Ack=2565 Win=48000 Len=0 TSval=3108697188 TSecr=371690795
1682  60.605795 10.29.96.106 -> 216.58.192.15 TCP 1484 [TCP segment of a reassembled PDU]
1683  60.605795 10.29.96.106 -> 216.58.192.15 TLSv1 398 Application Data
1684  60.608845 216.58.192.15 -> 10.29.96.106 TLSv1 320 New Session Ticket, Change Cipher Spec, Encrypted Handshake Message
1685  60.608917 10.29.96.106 -> 216.58.192.15 TCP 66 60726→443 [ACK] Seq=433 Ack=3602 Win=130816 Len=0 TSval=371690803 TSecr=3108697413
1686  60.609351 10.29.96.106 -> 216.58.192.15 TLSv1 780 Application Data, Application Data
1687  60.609544 10.29.96.106 -> 216.58.192.15 TLSv1 1484 Application Data
1688  60.609544 10.29.96.106 -> 216.58.192.15 TCP 1484 [TCP segment of a reassembled PDU]
1689  60.610571 216.58.192.15 -> 10.29.96.106 TCP 66 443→60725 [ACK] Seq=3602 Ack=5401 Win=53632 Len=0 TSval=3108697193 TSecr=371690795
1690  60.614962 216.58.192.15 -> 10.29.96.106 TCP 66 443→60726 [ACK] Seq=3602 Ack=2565 Win=48000 Len=0 TSval=3108697419 TSecr=371690803
1691  60.615039 10.29.96.106 -> 216.58.192.15 TCP 1484 [TCP segment of a reassembled PDU]
1692  60.615039 10.29.96.106 -> 216.58.192.15 TCP 1484 [TCP segment of a reassembled PDU]
1693  60.615040 10.29.96.106 -> 216.58.192.15 TCP 1484 [TCP segment of a reassembled PDU]
1694  60.620089 216.58.192.15 -> 10.29.96.106 TCP 66 443→60726 [ACK] Seq=3602 Ack=5401 Win=53632 Len=0 TSval=3108697424 TSecr=371690803
1695  60.620194 10.29.96.106 -> 216.58.192.15 TCP 1484 [TCP segment of a reassembled PDU]
1696  60.620194 10.29.96.106 -> 216.58.192.15 TCP 1484 [TCP segment of a reassembled PDU]
1697  60.620195 10.29.96.106 -> 216.58.192.15 TCP 1484 [TCP segment of a reassembled PDU]
1698  60.620195 10.29.96.106 -> 216.58.192.15 TCP 1484 [TCP segment of a reassembled PDU]
1699  60.620488 216.58.192.15 -> 10.29.96.106 TCP 66 443→60726 [ACK] Seq=3602 Ack=8237 Win=59264 Len=0 TSval=3108697425 TSecr=371690808
1700  60.620579 10.29.96.106 -> 216.58.192.15 TCP 1484 [TCP segment of a reassembled PDU]
1701  60.620579 10.29.96.106 -> 216.58.192.15 TCP 1484 [TCP segment of a reassembled PDU]
1702  60.620580 10.29.96.106 -> 216.58.192.15 TLSv1 1484 Application Data
1703  60.620581 10.29.96.106 -> 216.58.192.15 TCP 1484 [TCP segment of a reassembled PDU]
1704  60.625789 216.58.192.15 -> 10.29.96.106 TCP 66 443→60726 [ACK] Seq=3602 Ack=11073 Win=64896 Len=0 TSval=3108697430 TSecr=371690813
1705  60.625855 10.29.96.106 -> 216.58.192.15 TCP 1484 [TCP segment of a reassembled PDU]
1706  60.625856 10.29.96.106 -> 216.58.192.15 TCP 1484 [TCP segment of a reassembled PDU]
1707  60.625856 10.29.96.106 -> 216.58.192.15 TCP 1484 [TCP segment of a reassembled PDU]
1708  60.625856 10.29.96.106 -> 216.58.192.15 TCP 1484 [TCP segment of a reassembled PDU]
1709  60.625911 216.58.192.15 -> 10.29.96.106 TCP 66 443→60726 [ACK] Seq=3602 Ack=13909 Win=70656 Len=0 TSval=3108697430 TSecr=371690813
1710  60.625943 216.58.192.15 -> 10.29.96.106 TCP 66 443→60726 [ACK] Seq=3602 Ack=16745 Win=76288 Len=0 TSval=3108697430 TSecr=371690813
1711  60.625947 10.29.96.106 -> 216.58.192.15 TCP 1484 [TCP segment of a reassembled PDU]
1712  60.625947 10.29.96.106 -> 216.58.192.15 TCP 1484 [TCP segment of a reassembled PDU]
1713  60.625948 10.29.96.106 -> 216.58.192.15 TLSv1 1123 Application Data
1714  60.626198 216.58.192.15 -> 10.29.96.106 TCP 66 443→60726 [ACK] Seq=3602 Ack=19581 Win=81920 Len=0 TSval=3108697430 TSecr=371690813
1715  60.631417 216.58.192.15 -> 10.29.96.106 TCP 66 443→60726 [ACK] Seq=3602 Ack=22417 Win=87680 Len=0 TSval=3108697436 TSecr=371690818
1716  60.631613 216.58.192.15 -> 10.29.96.106 TCP 66 443→60726 [ACK] Seq=3602 Ack=25253 Win=93312 Len=0 TSval=3108697436 TSecr=371690818
1717  60.631857 216.58.192.15 -> 10.29.96.106 TCP 66 443→60726 [ACK] Seq=3602 Ack=28089 Win=98944 Len=0 TSval=3108697436 TSecr=371690818
1718  60.652054 216.58.192.15 -> 10.29.96.106 TCP 66 443→60725 [ACK] Seq=3602 Ack=5733 Win=56448 Len=0 TSval=3108697235 TSecr=371690800
1719  60.671671 216.58.192.15 -> 10.29.96.106 TCP 66 443→60726 [ACK] Seq=3602 Ack=29146 Win=101760 Len=0 TSval=3108697476 TSecr=371690818
1720  60.687695   10.29.96.2 -> 224.0.0.18   VRRP 54 Announcement (v2)
1721  60.772421 10.29.96.151 -> 224.0.0.251  MDNS 332 Standard query response 0x0000  PTR, cache flush Molly-Seligmans-iPhone.local PTR, cache flush Molly-Seligmans-iPhone.local AAAA, cache flush fe80::100e:9b94:d066:bdb0 A, cache flush 10.29.96.151
1722  61.416017 10.29.96.114 -> 224.0.0.251  MDNS 156 Standard query 0x0000  PTR _00000000-6f24-3c16-b2ae-8c0511e04913._sub._home-sharing._tcp.local, "QU" question
1723  61.520554  10.29.112.2 -> 224.0.0.18   VRRP 54 Announcement (v2)
1724  61.836856 216.58.192.15 -> 10.29.96.106 TLSv1 1479 Application Data
1725  61.836935 10.29.96.106 -> 216.58.192.15 TCP 66 60725→443 [ACK] Seq=5733 Ack=5015 Win=129632 Len=0 TSval=371692023 TSecr=3108698390
1726  61.837257 216.58.192.15 -> 10.29.96.106 TLSv1 1479 Application Data
1727  61.837261 216.58.192.15 -> 10.29.96.106 TLSv1 1479 Application Data
1728  61.837262 216.58.192.15 -> 10.29.96.106 TLSv1 471 Application Data
1729  61.837283 216.58.192.15 -> 10.29.96.106 TLSv1 471 [TCP Retransmission] Application Data
1730  61.837313 10.29.96.106 -> 216.58.192.15 TCP 66 60725→443 [ACK] Seq=5733 Ack=6428 Win=129632 Len=0 TSval=371692023 TSecr=3108698390
1731  61.837313 10.29.96.106 -> 216.58.192.15 TCP 66 60725→443 [ACK] Seq=5733 Ack=7841 Win=128224 Len=0 TSval=371692023 TSecr=3108698390
1732  61.837321 10.29.96.106 -> 216.58.192.15 TCP 66 60725→443 [ACK] Seq=5733 Ack=8246 Win=127840 Len=0 TSval=371692023 TSecr=3108698390
1733  61.837340 10.29.96.106 -> 216.58.192.15 TCP 66 [TCP Dup ACK 1732#1] 60725→443 [ACK] Seq=5733 Ack=8246 Win=127840 Len=0 TSval=371692023 TSecr=3108698400
1734  61.839399 10.29.96.106 -> 216.58.192.15 TCP 66 [TCP Window Update] 60725→443 [ACK] Seq=5733 Ack=8246 Win=131072 Len=0 TSval=371692025 TSecr=3108698400
1735  61.839540 10.29.96.106 -> 216.58.192.15 TCP 66 60725→443 [FIN, ACK] Seq=5733 Ack=8246 Win=131072 Len=0 TSval=371692025 TSecr=3108698400
1736  61.844643 216.58.192.15 -> 10.29.96.106 TCP 66 443→60725 [FIN, ACK] Seq=8246 Ack=5734 Win=56448 Len=0 TSval=3108698427 TSecr=371692025
1737  61.844718 10.29.96.106 -> 216.58.192.15 TCP 66 60725→443 [ACK] Seq=5734 Ack=8247 Win=131072 Len=0 TSval=371692030 TSecr=3108698427
1738  61.876398 173.194.203.125 -> 10.29.96.106 TCP 551 [TCP segment of a reassembled PDU]
1739  61.876501 10.29.96.106 -> 173.194.203.125 TCP 66 60139→5222 [ACK] Seq=4133 Ack=5336 Win=4080 Len=0 TSval=371692061 TSecr=2590463134
1740  61.883259  10.29.96.47 -> 224.0.0.251  MDNS 156 Standard query 0x0000  PTR _00000000-10af-68d1-98e4-6fc644fb420f._sub._home-sharing._tcp.local, "QU" question
1741  61.945661 216.58.192.15 -> 10.29.96.106 TLSv1 1479 Application Data
1742  61.945670 216.58.192.15 -> 10.29.96.106 TLSv1 1479 Application Data
1743  61.945673 216.58.192.15 -> 10.29.96.106 TLSv1 1479 Application Data
1744  61.945786 216.58.192.15 -> 10.29.96.106 TLSv1 487 Application Data
1745  61.945814 10.29.96.106 -> 216.58.192.15 TCP 66 60726→443 [ACK] Seq=29146 Ack=5015 Win=129632 Len=0 TSval=371692130 TSecr=3108698750
1746  61.945870 10.29.96.106 -> 216.58.192.15 TCP 66 60726→443 [ACK] Seq=29146 Ack=6428 Win=128224 Len=0 TSval=371692130 TSecr=3108698750
1747  61.945871 10.29.96.106 -> 216.58.192.15 TCP 66 60726→443 [ACK] Seq=29146 Ack=7841 Win=126816 Len=0 TSval=371692130 TSecr=3108698750
